published_date,title,summary,ticker,ticker_sentiment_score,ticker_sentiment_label
20250101T100600,10 Stock Market Predictions for 2025,"Here's what to expect from the stock market, along with some of Wall Street's hottest trends and most influential businesses, in the new year.",AAPL,0.151611,Somewhat-Bullish
20250101T112008,Should Vanguard S&P 500 Growth ETF  ( VOOG )  Be on Your Investing Radar?,Style Box ETF report for ...,AAPL,0.069019,Neutral
20250101T112008,Should Vanguard S&P 500 ETF  ( VOO )  Be on Your Investing Radar?,Style Box ETF report for ...,AAPL,0.072464,Neutral
20250101T141541,"EXCLUSIVE: Top 20 Most-Searched Tickers On Pro In December 2024 - Where Do Tesla, Nvidia, Quantum Computing Stock Rank? - Apple  ( NASDAQ:AAPL ) ","Each trading day features hundreds of headlines and press releases on Benzinga Pro, a source for traders to see the latest news on the overall market and individual tickers. Here is a look at the most-searched stocks on Benzinga Pro for December 2024.",AAPL,0.066368,Neutral
20250101T150027,"Competitor Analysis: Evaluating Apple And Competitors In Technology Hardware, Storage & Peripherals Industry - Apple  ( NASDAQ:AAPL ) ","In the ever-evolving and intensely competitive business landscape, conducting a thorough company analysis is of utmost importance for investors and industry followers.",AAPL,0.250432,Somewhat-Bullish
20250101T180019,"Warren Buffett Says Buy S&P 500, But This Tech Investor Warns Of A 'Rude Awakening' - Microsoft  ( NASDAQ:MSFT ) , Apple  ( NASDAQ:AAPL ) ","Investing in the S&P 500 index could be a high-risk gamble, suggests Palihapitiya, as a few tech giants sway market stability. Palihapitiya contrasts Buffett's conservative investment approach with cautionary advice amid his own SPAC endorsements.",AAPL,-0.051049,Neutral
20250102T022801,"Tim Cook, Mark Zuckerberg, Elon Musk, And More: Tech Moguls Post Upbeat New Year Greetings: 'Have A Good Feeling About 2025' - Alphabet  ( NASDAQ:GOOG ) , Apple  ( NASDAQ:AAPL ) ","As the world stepped into 2025, some of the biggest names in tech took to social media to share their New Year's greetings, hopes, and bold visions for the future. What Happened: Taking to X, formerly Twitter, Apple Inc. AAPL CEO Tim Cook expressed wishes for health and happiness for all.",AAPL,0.069175,Neutral
20250102T081345,Apple Discounts iPhone 16 Prices In China By Up To $68.5 As It Battles Huawei's Resurgence In The Country - Apple  ( NASDAQ:AAPL ) ,"Apple Inc. AAPL is offering discounts of up to 500 yuan ( $68.50 ) on its iPhone 16 models in China as it faces increasing competition from Huawei Technologies. What Happened: Apple has launched a rare promotional event in China, set to run from Jan. 4 to Jan. 7, 2025, reported Reuters.",AAPL,0.172626,Somewhat-Bullish
20250102T112007,Should iShares Core S&P 500 ETF  ( IVV )  Be on Your Investing Radar?,Style Box ETF report for ...,AAPL,0.072027,Neutral
20250102T112223,"UBS Cuts iPhone Sales Forecast For December Amid Stiff Competition From Rivals, Maintains Neutral Rating - Apple  ( NASDAQ:AAPL ) ","UBS forecasts lower iPhone sales forecast. Apple competitors' market share increase. After Apple Inc.'s AAPL market share fell in China in the third quarter of 2024, UBS has forecast weaker iPhone sales in the month of December.",AAPL,0.161565,Somewhat-Bullish
20250102T121500,2 Magnificent Artificial Intelligence  ( AI )  Stocks to Buy in 2025,The artificial intelligence ( AI ) investing sector is a gold mine for finding companies with market-beating potential. Nvidia ( NASDAQ: NVDA ) and Taiwan Semiconductor Manufacturing ( NYSE: TSM ) are among the stocks that I think can outperform the market over the next five years.,AAPL,0.110389,Neutral
20250102T130929,"Broadcom Thrives with 114% Stock Surge in AI Boom, While Intel Faces Steep Decline - Broadcom  ( NASDAQ:AVGO ) , Intel  ( NASDAQ:INTC ) ","The year 2024 proved very eventful for the semiconductor companies in the U.S. tech sector. It rewarded those, including Nvidia Corp NVDA and Broadcom Inc AVGO, that successfully tapped the artificial intelligence wave while punishing those that failed, like Intel Corp INTC.",AAPL,-0.135115,Neutral
20250102T150028,"Assessing Apple's Performance Against Competitors In Technology Hardware, Storage & Peripherals Industry - Apple  ( NASDAQ:AAPL ) ","In today's rapidly changing and fiercely competitive business landscape, it is vital for investors and industry enthusiasts to carefully evaluate companies. In this article, we will perform a comprehensive industry comparison, evaluating Apple AAPL against its key competitors in the Technology ...",AAPL,0.373433,Bullish
20250102T180252,"Market Clubhouse Morning Memo - January 2nd, 2024  ( Trade Strategy For SPY, QQQ, AAPL, MSFT, NVDA, GOOGL, META and TSLA ) ","Good Morning Traders! In today's Market Clubhouse Morning Memo, we will discuss SPY, QQQ, AAPL, MSFT, NVDA, GOOGL, META, and TSLA. Our proprietary formula, exclusive to Market Clubhouse, dictates these price levels. This dynamic equation takes into account price, volume, and options flow.",AAPL,-0.068991,Neutral
20250102T192509,Some Investors Are Selling Apple Stock Thursday: Here's Why - Apple  ( NASDAQ:AAPL ) ,"Apple is running a four-day promotional period, discounting iPhone models in China by up to 500 yuan. Apple is reportedly battling market share declines as local competition intensifies in China. Get Monthly Picks of Market's Fastest Movers",AAPL,0.185768,Somewhat-Bullish
20250102T193210,"Stock Market's New Year Mantra - Trump, Bitcoin, AI, And Quantum Will Fix Everything - EOG Resources  ( NYSE:EOG ) , Devon Energy  ( NYSE:DVN ) ","To gain an edge, this is what you need to know today. An enlarged chart of SPDR S&P 500 ETF Trust which represents the benchmark stock market index S&P 500 ( SPX ) . Trump will fix everything. At The Arora Report, we would like nothing more than to see Trump succeed.",AAPL,-0.286532,Somewhat-Bearish
20250102T221000,"Music Production Software Market to Grow by USD 432.8 Million  ( 2025-2029 ) , Rising Number of Musicians and Artists Boost Market, AI-Driven Transformation - Technavio","NEW YORK, Jan. 2, 2025 /PRNewswire/ -- Report with the AI impact on market trends - The global music production software market size is estimated to grow by USD 432.8 million from 2025-2029, according to Technavio. The market is estimated to grow at a CAGR of almost 7.7% during the forecast ...",AAPL,0.040564,Neutral
20250103T033022,"Biden-Era Net Neutrality Rules Overturned By Federal Appeals Court: What It Means For Net Freedom, Cybersecurity And Consumers - Apple  ( NASDAQ:AAPL ) , Amazon.com  ( NASDAQ:AMZN ) ","On Thursday, the U.S. Court of Appeals for the 6th Circuit struck down the Federal Communications Commission's net neutrality rules. What Happened: This decision represents a major policy win for Republicans and poses a challenge to the Joe Biden administration's internet regulation agenda.",AAPL,0.079852,Neutral
20250103T035946,Apple Settles $95 Million Lawsuit Over Siri Privacy Violations: Here's The Amount Affected Users Will Receive - Apple  ( NASDAQ:AAPL ) ,"Apple Inc. AAPL has agreed to pay $95 million to settle a lawsuit alleging its Siri voice assistant recorded users' private conversations without consent, according to court documents filed Tuesday at the U.S. District Court for the Northern District of California.",AAPL,0.051318,Neutral
20250103T052945,"Samsung Challenges Google With $60 Fitbit Killer, Also Brings $200 Budget Smartphone To The US: What You Need To Know - Alphabet  ( NASDAQ:GOOG ) , Apple  ( NASDAQ:AAPL ) ","Samsung Electronics Co. SSNLF has introduced two new devices in the U.S. market: the Galaxy Fit 3 and the Galaxy A16 5G. What Happened: These products, initially launched in other regions last October, are now available for American consumers.",AAPL,0.255796,Somewhat-Bullish
20250103T073344,"Apple Rival Huawei, Alibaba And Others Get Boost As China Doles Out Subsidies To Smartphone Buyers - Alibaba Gr Hldgs  ( NYSE:BABA ) , Apple  ( NASDAQ:AAPL ) ","China is expanding consumption subsidies to include smartphones and other electronics. What Happened: The national trade-in program, which currently covers home appliances and vehicles, will now extend to personal devices such as phones, tablets, and smartwatches.",AAPL,-0.069744,Neutral
20250103T083500,Nvidia Stock vs. Apple Stock: Billionaires Buy One and Sell the Other Ahead of 2025,"Nvidia ( NASDAQ: NVDA ) and Apple ( NASDAQ: AAPL ) are very popular stocks among individual and institutional investors, but two highly successful hedge fund managers aggressively bought one and sold the other in the third quarter:Importantly, Griffin and Cohen rank among the most successful ...",AAPL,0.187305,Somewhat-Bullish
20250103T092800,These 5 Artificial Intelligence  ( AI )  Stocks Make Up 28.8% of the Entire S&P 500 Index,"The S&P 500 ( SNPINDEX: ^GSPC ) is home to 500 companies from 11 different sectors of the economy, making it the most diversified of the major U.S. stock market indexes.But the S&P is weighted by market capitalization, so the largest companies have a greater influence over its performance than ...",AAPL,0.159981,Somewhat-Bullish
20250103T095000,Could Buying Apple Stock Today Set You Up for Life?,"Apple would have turned a mere $1,000 investment into a $2.5 million fortune on its way to becoming one of the world's most prominent companies.",AAPL,0.583995,Bullish
20250103T101100,3 Tech Mutual Funds to Thrive Amid Strong Labor Conditions,"With a resilient U.S. labor market and the Federal Reserve's cautious stance on interest rates, tech mutual funds like FSELX, KTCAX and PRSCX offer promising investment opportunities.",AAPL,0.056527,Neutral
20250103T101500,"Is Apple a Buy, Sell, or Hold in 2025?",Here's the latest on the largest publicly traded company in the world.,AAPL,0.427587,Bullish
20250103T102307,"Microsoft's Copilot Plus Set To Expand To Mini PCs At CES As Windows-Maker Looks To Take On Apple's Mac Mini - Apple  ( NASDAQ:AAPL ) , Advanced Micro Devices  ( NASDAQ:AMD ) ","Microsoft Corp. MSFT is broadening its artificial intelligence hardware strategy with a new wave of compact desktop computers featuring dedicated Copilot capabilities, as manufacturers prepare to showcase their latest offerings at the Consumer Electronics Show next week.",AAPL,0.192517,Somewhat-Bullish
20250103T104500,Microsoft vs. Amazon: Which Cloud-Computing Stock Will Outperform in 2025?,"Both Amazon ( NASDAQ: AMZN ) and Microsoft ( NASDAQ: MSFT ) saw strong growth in their cloud-computing business units in 2024. While Microsoft's Azure saw the higher revenue growth, it was Amazon's stock that outperformed in 2024.Let's see which stock could be the bigger winner this year.Cloud ...",AAPL,-0.014864,Neutral
20250103T105850,"Warren Buffett's S&P 500 Fund Strategy Faces New Challenge As Market Concentration Hits Levels Not Seen Since 1930s: Top 10 Companies Now 800X Bigger Than 75% Of Stocks On The Index - Apple  ( NASDAQ:AAPL ) , Amazon.com  ( NASDAQ:AMZN ) ","Warren Buffett advises individuals to invest in low-cost S&P 500 index funds for long-term gains, rather than attempting to time the market or pick stocks. However, The Kobeissi Letter revealed a concerning trend on Thursday.",AAPL,0.225202,Somewhat-Bullish
20250103T112006,Should WisdomTree U.S. Total Dividend ETF  ( DTD )  Be on Your Investing Radar?,Style Box ETF report for DTD ...,AAPL,0.062464,Neutral
20250103T112007,Should Fidelity Quality Factor ETF  ( FQAL )  Be on Your Investing Radar?,Style Box ETF report for ...,AAPL,0.071096,Neutral
20250103T120000,"1 Top Vanguard ETF That Can Turn $50,000 Into Over $1 Million","If you're investing a large sum of money in the stock market, it can be a bit of a challenge finding the right type of investment. Although you want to earn a good return to make the most of that money, you also want to be careful not to take on a lot of risk and incur a huge loss, either.",AAPL,0.111944,Neutral
20250103T122400,NVIDIA Skyrockets 171% in 2024: Will the Stock Outshine Again in 2025?,"While NVDA remains a powerhouse in the semiconductor industry with a compelling long-term growth story, its premium valuation suggests caution.",AAPL,0.121508,Neutral
20250103T130000,Will S&P 500 ETFs See Slow Gains in 2025 After Two Strong Years?,"While the fundamental backdrop for equities remains positive, strategists expect a more moderate and volatile year for the S&P 500 in 2025.",AAPL,0.106217,Neutral
20250103T140016,Investors Heavily Search Apple Inc.  ( AAPL ) : Here is What You Need to Know,"Zacks.com users have recently been watching Apple (AAPL) quite a bit. Thus, it is worth knowing the facts that could determine the stock's prospects.",AAPL,0.171113,Somewhat-Bullish
20250103T150037,"Evaluating Apple Against Peers In Technology Hardware, Storage & Peripherals Industry - Apple  ( NASDAQ:AAPL ) ","In the dynamic and fiercely competitive business environment, conducting a thorough analysis of companies is crucial for investors and industry enthusiasts. In this article, we will perform an extensive industry comparison, evaluating Apple AAPL in relation to its major competitors in the ...",AAPL,0.364935,Bullish
20250103T162752,"Apple iPhones Lose Ground In China As Subsidies Boost Huawei, Domestic Rivals - Apple  ( NASDAQ:AAPL ) , Xiaomi  ( OTC:XIACY ) ","November shipments of foreign-made phones in China plummeted as Apple, Inc. AAPL struggles to maintain market share in the face of China's government subsidies and support of its domestic brands.",AAPL,0.140931,Neutral
20250103T180000,What Lies Ahead for Apple Stock & ETFs in 2025?,Apple stock has gained momentum lately due to the addition of ChatGPT and other AI features for its devices and the launch of the new MacBook Pro lineup.,AAPL,0.339699,Somewhat-Bullish
20250103T182831,"Nvidia's $2 Trillion AI Rally In 2024 Fueled by Chips, Startups, and Robotics - NVIDIA  ( NASDAQ:NVDA ) ","The artificial intelligence frenzy and demand for its AI-centric chips catapulted Nvidia Corp NVDA into the trillion-dollar market cap club for 2024. It lags behind Apple Inc AAPL, which was backed by investor curiosity over its potential AI offerings, turbocharging its iPhone sales.",AAPL,-0.072151,Neutral
20250103T214349,"Heavy Money Flows In Quantum Computing Stocks, Blind Money Saves The Market, Bitcoin Outflows - Arqit Quantum  ( NASDAQ:ARQQ ) ","To gain an edge, this is what you need to know today. An enlarged chart of SPDR S&P 500 ETF Trust which represents the benchmark stock market index S&P 500 ( SPX ) . We shared with readers in yesterday's Morning Capsule, Apple Inc iPhones are on the decline in China.",AAPL,-0.089868,Neutral
20250103T224521,Apple  ( AAPL )  Stock Falls Amid Market Uptick: What Investors Need to Know,"The latest trading day saw Apple (AAPL) settling at $243.36, representing a -0.2% change from its previous close.",AAPL,0.302443,Somewhat-Bullish
20250104T041118,"Apple CEO Tim Cook Reportedly Donates $1 Million To Trump Inauguration, Joins Ranks Of Mark Zuckerberg, Jeff Bezos, And Sam Altman - Apple  ( NASDAQ:AAPL ) ","Apple Inc. AAPL CEO Tim Cook reportedly donated $1 million to President-elect Donald Trump's inaugural committee, joining the ranks of other major tech leaders like Jeff Bezos, Mark Zuckerberg, and Sam Altman, among others.",AAPL,0.385003,Bullish
20250104T083000,"2 Artificial Intelligence  ( AI )  Stocks to Buy Before They Soar to $4 Trillion in 2025, According to a Wall Street Analyst","Equity analyst Dan Ives has made a quite a few prescient calls in his career. In the last year alone, he predicted the Nasdaq Composite would hit 20,000, and he remained bullish on Palantir despite widespread skepticism.",AAPL,0.437372,Bullish
20250104T090000,Prediction: 2 AI Stocks Will Be Worth More Than Apple Stock by the Year's End in 2025,"Apple had a market value of $3.7 trillion as of Dec. 31, making it the most valuable U.S. company, a title it has held for the better part of the last decade. But Apple has yet to demonstrate its ability to monetize artificial intelligence, at least not to the same degree as other big tech ...",AAPL,0.222488,Somewhat-Bullish
20250104T123219,"EXCLUSIVE: Top 20 Most-Searched Tickers On Pro In 2024 - Where Do Tesla, Nvidia, GameStop, Trump Media Stocks Rank? - Apple  ( NASDAQ:AAPL ) ","A look at the most-searched tickers on Benzinga Pro for the full 2024 year. Several Magnificent 7 stocks rank in the top 10, with multiple Bitcoin-related stocks ranking in the top 20.",AAPL,0.079519,Neutral
20250104T163519,"Consumer Tech News  ( Dec 30-Jan 3 ) : Apple Stops Selling iPhone 14, iPhone 14 Plus, iPhone SE, Trump Seeks A 'Political Resolution' Of TikTok Ban & More - Microsoft  ( NASDAQ:MSFT ) , Apple  ( NASDAQ:AAPL ) ","The European Union's ( EU ) USB-C directive has officially come into force, mandating a universal charging port for electronic devices. The directive, effective from 2025, requires mobile phones to feature a USB-C port.",AAPL,0.015137,Neutral
20250105T090400,Should You Buy Apple Stock Right Now in 2025?,"Apple ( NASDAQ: AAPL ) has struggled to generate growth in recent years.*Stock prices used were the afternoon prices of Jan. 1, 2025. The video was published on Jan. 3, 2025.Continue reading ...",AAPL,-0.601535,Bearish
20250105T093000,"Is Apple a Buy, Sell, or Hold in 2025?","Apple ( NASDAQ: AAPL ) is one the world's largest publicly traded companies, with a market cap of $3.7 trillion and it continues to attract investor attention as it slowly steps into new areas of innovation, like artificial intelligence ( AI ) .The tech stock easily outpaced the S&P 500 over the ...",AAPL,0.430515,Bullish
20250105T102900,Can Shiba Inu Reach $1 in 2025? The Answer Will Make Your Head Spin.,"The Shiba Inu ( CRYPTO: SHIB ) cryptocurrency opened at a price of $0.00000000008 per token in 2021 before soaring by a whopping 107,499,900% to a peak of $0.000086 in October of that year. If you had a crystal ball and timed your investment perfectly, that gain could have turned just $1 into ...",AAPL,0.172908,Somewhat-Bullish
20250105T104600,This Top Warren Buffett Stock Could Soar Even Higher in 2025. Time to Buy?,"Excluding the stock positions Buffett trimmed throughout 2024, this is by far the famed investor's biggest bet.",AAPL,0.125256,Neutral
20250105T130220,"iPhone 17 Leak, Tim Cook's Donation To Trump Inauguration, And China's Subsidies To Homegrown Players: This Week In Appleverse - Apple  ( NASDAQ:AAPL ) ","The past week was a rollercoaster ride for Apple Inc. AAPL. From leaks about the iPhone 17's display upgrade to CEO Tim Cook's hefty donation to Trump's inauguration, the tech giant was in the limelight for various reasons.",AAPL,0.222109,Somewhat-Bullish
20250106T090500,Nearly 66% of Warren Buffett's Portfolio Is Invested in These 5 Stocks as 2025 Begins,"Diversification ranks among the most important components of many investment strategies. However, one of the world's greatest investors isn't gung ho about the idea. Warren Buffett once said, ""Diversification is protection against ignorance.",AAPL,0.220778,Somewhat-Bullish
20250106T101500,3 Eaton Vance Mutual Funds for Long-term Returns,"Invest in Eaton Vance mutual funds like EVIFX, EAPCX and EAERX for sustainable returns.",AAPL,-0.01956,Neutral
20250106T101700,"Apple Supplier Foxconn Posts Record Revenue, Rides High On AI Server Demand And Nvidia Partnership - NVIDIA  ( NASDAQ:NVDA ) ","Apple Inc. AAPL and Nvidia Corp. NVDA supplier Foxconn, also known as Hon Hai Technology, posted record revenue in the fourth quarter driven by higher cloud and networking products revenue and strong demand from AI servers.",AAPL,0.163152,Somewhat-Bullish
20250106T105800,Prediction: 1 Stock That Will Be Worth More Than Verizon 5 Years From Now,"Hockey legend Wayne Gretzky once said that part of his greatness was because ""I skate to where the puck is going to be, not where it has been."" In other words, his precise ability to anticipate the next move set him apart from the pack.",AAPL,0.147675,Neutral
20250106T112005,Should WisdomTree U.S. LargeCap ETF  ( EPS )  Be on Your Investing Radar?,Style Box ETF report for ...,AAPL,0.065553,Neutral
20250106T112006,Should Fidelity Value Factor ETF  ( FVAL )  Be on Your Investing Radar?,Style Box ETF report for ...,AAPL,0.069101,Neutral
20250106T112007,Is Invesco S&P 500 Quality ETF  ( SPHQ )  a Strong ETF Right Now?,Smart Beta ETF report for ...,AAPL,0.060813,Neutral
20250106T112008,Is Vanguard Dividend Appreciation ETF  ( VIG )  a Strong ETF Right Now?,Smart Beta ETF report for VIG ...,AAPL,0.061438,Neutral
20250106T115126,OpenAI CEO Sam Altman Says Company Losing Money On ChatGPT Pro Plan - Microsoft  ( NASDAQ:MSFT ) ,"OpenAI CEO admits ChatGPT Pro plan is losing money. OpenAI aims to develop superintelligent systems as critics question OpenAI's commercial ambitions. On Sunday, Microsoft Corp MSFT backed OpenAI CEO Sam Altman disclosed that the company is currently operating at a loss on its $200 per month ...",AAPL,0.054854,Neutral
20250106T120500,1 Wall Street Analyst Thinks Apple Is Going to $325. Is It a Buy Around $250?,"Apple ( NASDAQ: AAPL ) is back on top of the stock market. The tech giant peaked in December at a market cap of $3.9 billion as the iPhone maker has soared recently on hopes for Apple Intelligence, its generative AI tools that are now built into iOS, and the market's belief that the Trump ...",AAPL,0.442785,Bullish
20250106T130000,"Can ""Magnificent Seven"" ETFs Retain Their Glory in 2025?","The ""Magnificent 7"" stocks are likely to see slower earnings growth and price appreciation in 2025, but their dominance will be undeniable.",AAPL,0.191387,Somewhat-Bullish
20250106T135322,"AI Chip Stocks Nvidia, Broadcom, AMD, Taiwan Semi, Micron, Super Micro Surge Premarket: Whats Going On? - Apple  ( NASDAQ:AAPL ) , Advanced Micro Devices  ( NASDAQ:AMD ) ","Semiconductor chips stocks, including Nvidia Corp NVDA, Advanced Micro Devices, Inc AMD, Broadcom Inc AVGO, Taiwan Semiconductor Manufacturing Co TSM, STMicroelectronics STM, Marvell Technology, Inc MRVL, Micron Technology, Inc MU, Arm Holdings plc ARM, Qualcomm Inc QCOM, Super Micro Computer, ...",AAPL,0.148898,Neutral
20250106T135553,"Market Clubhouse Morning Memo - January 5th, 2024  ( Trade Strategy For SPY, QQQ, AAPL, MSFT, NVDA, GOOGL, META and TSLA ) ","Good Morning Traders! In today's Market Clubhouse Morning Memo, we will discuss SPY, QQQ, AAPL, MSFT, NVDA, GOOGL, META, and TSLA. Our proprietary formula, exclusive to Market Clubhouse, dictates these price levels. This dynamic equation takes into account price, volume, and options flow.",AAPL,-0.011113,Neutral
20250106T150032,"Insights Into Apple's Performance Versus Peers In Technology Hardware, Storage & Peripherals Sector - Apple  ( NASDAQ:AAPL ) ","In the ever-evolving and intensely competitive business landscape, conducting a thorough company analysis is of utmost importance for investors and industry followers.",AAPL,0.368409,Bullish
20250106T175557,"AI, Quantum, And Robotics in Focus - All Eyes On Nvidia CEO Keynote - Applied Mat  ( NASDAQ:AMAT ) , Apple  ( NASDAQ:AAPL ) ","To gain an edge, this is what you need to know today. This article is about the big picture, not an individual stock. The chart of NVDA stock is being used to illustrate the point. The chart shows that NVDA stock ran up on Friday in advance of the Consumer Electronics Shows ( CES ) .",AAPL,0.082035,Neutral
20250106T214851,Buffett Beats S&P 500 In 2024: Let's Compare The Past 20 Years - SPDR S&P 500  ( ARCA:SPY ) ,"Berkshire Hathaway, led by Warren Buffett, outperformed the leading S&P 500 ETF in 2024. A look at the returns of the two investments over the last 20 years. Legendary investor Warren Buffett had a 2024 to remember with Berkshire Hathaway Inc BRKBRK reaching the $1 trillion market capitalization ...",AAPL,0.298804,Somewhat-Bullish
20250107T072308,"Apple Admits AI Flaws After BBC Complains, Vows Fix For Misleading News Summaries - Apple  ( NASDAQ:AAPL ) ","Apple Inc. AAPL has committed to updating its AI feature following a complaint from the BBC. What Happened: The tech giant acknowledged on Monday that its AI-generated news summaries on iPhones have been inaccurate, reported BBC.",AAPL,0.198309,Somewhat-Bullish
20250107T081655,"Amid Nvidia's CES 2025 Buzz, Investors Overlooked Apple Supplier Foxconn's Strong Q4, Says Jim Cramer - NVIDIA  ( NASDAQ:NVDA ) ","Leading market analysts highlighted Foxconn, also known as Hon Hai Technology's surprise fourth-quarter performance. Jim Cramer suggested investors may have overlooked the Apple Inc. AAPL supplier while focusing on Nvidia Corp.'s NVDA CES 2025 presentation.",AAPL,0.032533,Neutral
20250107T091500,Warren Buffett's Warning to Wall Street Reached Deafening Proportions in 2024. Here's What to Do as 2025 Gets Started.,"Warren Buffett has demonstrated his understanding of the market over the long term -- and his ability to turn that knowledge into wise investing decisions. As chairman of Berkshire Hathaway, he helped deliver a compounded annual gain of more than 19% over the past 58 years -- largely beating the ...",AAPL,0.102999,Neutral
20250107T092938,Amazon's Ring Introduces Smart Smoke Alarms At CES 2025 Starting At $55 - Amazon.com  ( NASDAQ:AMZN ) ,Amazon.com Inc.'s Ring AMZN has expanded its home security portfolio with the launch of smart smoke and carbon monoxide alarms. What Happened: Amazon's Ring is partnering with fire safety product maker Kidde to launch two new products: the Kidde Smart Smoke Alarm with Ring and the Kidde Smart ...,AAPL,0.320781,Somewhat-Bullish
20250107T101500,3 Columbia Mutual Funds to Buy Now for Maximizing Returns,"Consider investing in Columbia Threadneedle Investments mutual funds like LEGAX, CTFAX and SLVAX for a diverse portfolio.",AAPL,0.054841,Neutral
