published_date,title,summary,ticker,ticker_sentiment_score,ticker_sentiment_label
20250122T131328,"Apple To $183? Here Are 10 Top Analyst Forecasts For Wednesday - Apple  ( NASDAQ:AAPL ) , Avino Silver & Gold Mines  ( AMEX:ASM ) ","Top Wall Street analysts changed their outlook on these top names. For a complete view of all analyst rating changes, including upgrades and downgrades, please see our analyst ratings page. B of A Securities raised the price target for Netflix, Inc. NFLX from $1,000 to $1,175.",AAPL,0.00536,Neutral
20250122T143900,"Netflix Q4 Earnings Beat, Revenues Rise Y/Y on Subscriber Gain","NFLX's top line gains from 18.91 million subscriber additions in the fourth quarter of 2024, while the company raises 2025 revenue forecast.",AAPL,-0.003121,Neutral
20250122T144600,Will Wearables Portfolio Expansion Push GRMN's Stock Price Higher?,"Although near-term challenges persist, Garmin's ongoing commitment to innovation with the new Approach S44 and S50 smartwatches makes it a compelling hold.",AAPL,0.130325,Neutral
20250122T150107,"Comparing Apple With Industry Competitors In Technology Hardware, Storage & Peripherals Industry - Apple  ( NASDAQ:AAPL ) ","In today's fast-paced and competitive business landscape, it is essential for investors and industry enthusiasts to thoroughly analyze companies before making investment decisions.",AAPL,0.41005,Bullish
20250122T150658,Should You Buy Apple Stock Before Jan. 30?,"Apple ( NASDAQ: AAPL ) is losing smartphone market share in China, where competition is increasing.*Stock prices used were the afternoon prices of Jan. 18, 2025. The video was published on Jan. 20, 2025.Continue reading ...",AAPL,-0.601535,Bearish
20250122T154516,"Warren Buffett Once Claimed iPhones Are So Great That No One Would Take $10,000 To Stop Buying Them - Apple  ( NASDAQ:AAPL ) ","Warren Buffett, one of the most famous investors ever, has long admired Apple AAPL and thinks it's one of the best companies in the world. He once made a bold claim that perfectly illustrates how much people love their iPhones.",AAPL,0.498694,Bullish
20250122T155311,"Stargate Adds Fuel To AI Frenzy, Chinese Stocks Sink On Trump Tariff Talk - Global X Artificial Intelligence & Technology ETF  ( NASDAQ:AIQ ) ","To gain an edge, this is what you need to know today. An enlarged chart of artificial intelligence ETF Global X Artificial Intelligence & Technology ETF AIQ. The chart shows there is a breakout in artificial intelligence ETF in the early trade this morning. As a caution, all breakouts do not ...",AAPL,-0.247544,Somewhat-Bearish
20250122T185500,"TikTok Chat, Big Bank Review, and Some Stocks Worth Watching","In this podcast, Motley Fool host Dylan Lewis and analysts Matt Argersinger and Bill Mann discuss:Then Motley Fool co-Founder David Gardner and host Ricky Mulvey talk about the stock market in 2025 and how to keep the short-term noise out of the way of your long-term returns.To catch full ...",AAPL,0.024364,Neutral
20250122T224518,Apple  ( AAPL )  Ascends But Remains Behind Market: Some Facts to Note,"In the closing of the recent trading day, Apple (AAPL) stood at $223.83, denoting a +0.53% change from the preceding trading day.",AAPL,0.248599,Somewhat-Bullish
20250122T233200,S&P 500 Misses New Closing High by 4 Points,"The S&P came close to closing at a new all-time high today at 6,086, but was just a few points shy of the record close on December 6th of last year.",AAPL,0.0,Neutral
20250123T021947,Apple's $510 Billion Market Cap Drop Opens Door For Nvidia To Reclaim World's Largest Company Title Amid iPhone Maker's China Struggles - NVIDIA  ( NASDAQ:NVDA ) ,"Apple Inc. AAPL has seen a staggering $510 billion decline in market capitalization over the past three weeks, paving the way for Nvidia Corp. NVDA to reclaim its position as the world's largest company, according to analysis from The Kobeissi Letter.",AAPL,0.045668,Neutral
20250123T042459,"Samsung, Google Team Up On AR Glasses Development, Duo To Enter Race Against Meta And Apple - Alphabet  ( NASDAQ:GOOG ) , Apple  ( NASDAQ:AAPL ) ","Samsung Electronics Co. SSNLF and Alphabet Inc.'s GOOG GOOGL Google have decided to team up to develop augmented reality glasses. What Happened: The development was confirmed by TM Roh, the president of Samsung's Mobile Experience division, in an interview with Bloomberg.",AAPL,0.122379,Neutral
20250123T081200,Could Nvidia Unseat Apple as the Largest Company in the World in 2025?,"Nvidia ( NASDAQ: NVDA ) and Apple ( NASDAQ: AAPL ) are the two largest companies in the world by market capitalization. While Nvidia is valued at roughly $3.38 trillion as of this writing and stands as the second-biggest business, Apple has a valuation of $3.46 trillion and is at the top of the ...",AAPL,0.462477,Bullish
20250123T100000,32.1% of Warren Buffett's $295 Billion Portfolio Is Invested in 4 Artificial Intelligence  ( AI )  Stocks,"Had you invested $1,000 in Berkshire Hathaway ( NYSE: BRK.A ) ( NYSE: BRK.B ) when Warren Buffett became its CEO in 1965, you would have $42.5 million today. The same investment in the S&P 500 would have grown to just $343,000 over the same period, which highlights Buffett's incredible ability to ...",AAPL,0.226102,Somewhat-Bullish
20250123T103000,Could This Bull Market Buy Help You Become a Millionaire?,"Apple ( NASDAQ: AAPL ) has proved itself to be a millionaire-maker in the past. The tech giant, seller of world-famous products including the iPhone and Mac, has built a solid track record of earnings growth, and that's translated into fantastic stock performance.",AAPL,0.537249,Bullish
20250123T112005,Should Franklin U.S. Large Cap Multifactor Index ETF  ( FLQL )  Be on Your Investing Radar?,Style Box ETF report for ...,AAPL,0.068857,Neutral
20250123T112007,Should Strive 500 ETF  ( STRV )  Be on Your Investing Radar?,Style Box ETF report for ...,AAPL,0.072027,Neutral
20250123T112955,"Samsung Teases Galaxy S25 Edge, To Take On Apple's Rumored iPhone 17 Air - Samsung Electronics Co  ( OTC:SSNLF ) ","On Wednesday, Samsung Electronics Co. SSNLF teased the ultrathin Galaxy S25 Edge, which can potentially take on Apple Inc.'s AAPL rumored iPhone 17 Air in the race for the slimmest smartphone. What Happened: Samsung showcased the Galaxy S25 Edge at the Samsung Unpacked event in San Jose, ...",AAPL,0.191025,Somewhat-Bullish
20250123T114200,Mark Zuckerberg May Be Right About Apple's Lack of Innovation. But Here's Why That Shouldn't Matter to Investors.,"Meta Platforms' CEO Mark Zuckerberg isn't a big fan of Apple ( NASDAQ: AAPL ) . In a recent interview with podcast host Joe Rogan, he was critical of the company and its lack of innovation over the years.And Zuckerberg really isn't necessarily wrong.",AAPL,0.275724,Somewhat-Bullish
20250123T123000,Breakfast News: Nvidia Leapfrogs Apple,"Nvidia's market cap rises, Coinbase CEO strikes upbeat tone, nuclear gets a boost, and more...",AAPL,0.231284,Somewhat-Bullish
20250123T124951,"Apple To $280? Here Are 10 Top Analyst Forecasts For Thursday - Apple  ( NASDAQ:AAPL ) , Amphenol  ( NYSE:APH ) ","Top Wall Street analysts changed their outlook on these top names. For a complete view of all analyst rating changes, including upgrades and downgrades, please see our analyst ratings page. Baird raised the price target for Amphenol Corporation APH from $85 to $89.",AAPL,0.005368,Neutral
20250123T130000,Trump Unveils Stargate AI Infrastructure Project: ETFs in Focus,"On Tuesday, Trump announced a $500 billion AI infrastructure initiative, spearheading a new company called Stargate.",AAPL,0.295056,Somewhat-Bullish
20250123T133500,3 Tech Funds to Buy as Wall Street Rally Resumes on AI Enthusiasm,"Funds like KTCAX, JNGTX and PRSCX are poised to benefit form the ongoing tech rally, driven by AI enthusiasm.",AAPL,0.174757,Somewhat-Bullish
20250123T150041,"Performance Comparison: Apple And Competitors In Technology Hardware, Storage & Peripherals Industry - Apple  ( NASDAQ:AAPL ) ","In the ever-changing and fiercely competitive business landscape, conducting thorough company analysis is crucial for investors and industry experts. In this article, we will undertake a comprehensive industry comparison, evaluating Apple AAPL and its primary competitors in the Technology ...",AAPL,0.351504,Bullish
20250123T154827,"Samsung Taps Google AI, Qualcomm Tech for Galaxy S25 to Rival Apple's iPhone - Samsung Electronics Co  ( OTC:SSNLF ) , Alphabet  ( NASDAQ:GOOGL ) , Qualcomm  ( NASDAQ:QCOM ) ","Samsung unveils Galaxy S25 series with Qualcomm chips and AI-powered by Google's Gemini, starting at $799. Galaxy S25 Edge launches in 2025, focusing on AI personalization to compete with Apple's iPhone 17 Air.",AAPL,0.138739,Neutral
20250123T165545,"Direction Of Stock Market Depends Upon Trump's Speech, Musk Throws Cold Water On AI Stargate - Bank of America  ( NYSE:BAC ) , Blackstone  ( NYSE:BX ) ","To gain an edge, this is what you need to know today. An enlarged chart of VanEck Semiconductor ETF SMH. The chart shows yesterday semiconductor stocks attempted to break above the micro resistance zone on Stargate excitement. The chart shows semiconductor stocks have pulled back to the top of ...",AAPL,0.240918,Somewhat-Bullish
20250123T191624,"Tesla Lost $15 Billion In Brand Value In 2024, Report Says: Did Elon Musk's Political Push Hurt EV Giant? - Tesla  ( NASDAQ:TSLA ) ",A Brand Finance annual survey says Tesla's rating fell in part due to Elon Musk's increased political commentary. A Dutch survey also shows that Musk's political comments could see Tesla owners ready to get rid of their vehicles.,AAPL,0.179204,Somewhat-Bullish
20250123T200500,3 Reasons to Buy TSMC Stock Beyond Record Q4 Net Profit,"Following a blowout Q4 net profit on solid AI chip demand, let's look at what makes TSMC a compelling stock to buy.",AAPL,0.184874,Somewhat-Bullish
20250124T060254,"Epic Games CEO Tim Sweeney Prepared To Spend Billions For Decades Fighting Apple, Google Monopolies: 'We Think Our Best Days Are Ahead' - Alphabet  ( NASDAQ:GOOG ) , Apple  ( NASDAQ:AAPL ) ","Tim Sweeney, CEO of Epic Games, has reaffirmed his commitment to the ongoing legal battle against Apple Inc. AAPL and Alphabet Inc.'s GOOG GOOGL Google. He is prepared to extend this fight for decades if necessary.",AAPL,-0.094183,Neutral
20250124T070700,"The Zacks Analyst Blog Taiwan Semiconductor Manufacturing, Broadcom, Marvell Technology and Apple","Taiwan Semiconductor Manufacturing, Broadcom, Marvell Technology and Apple are included in this Analyst Blog.",AAPL,0.137173,Neutral
20250124T112005,Is WisdomTree U.S. LargeCap ETF  ( EPS )  a Strong ETF Right Now?,Smart Beta ETF report for ...,AAPL,0.055673,Neutral
20250124T112007,Should Goldman Sachs MarketBeta U.S. 1000 Equity ETF  ( GUSA )  Be on Your Investing Radar?,Style Box ETF report for GUSA ...,AAPL,0.070609,Neutral
20250124T121548,"Apple To $253? Here Are 10 Top Analyst Forecasts For Friday - Apple  ( NASDAQ:AAPL ) , Alcon  ( NYSE:ALC ) ","Top Wall Street analysts changed their outlook on these top names. For a complete view of all analyst rating changes, including upgrades and downgrades, please see our analyst ratings page. JP Morgan raised the price target for Bath & Body Works, Inc. BBWI from $39 to $41.",AAPL,-0.039624,Neutral
20250124T121700,Should You Forget Nvidia and Buy This Tech Stock Instead?,Looking for the next big thing in AI and tech stocks? Check out why one supporting player might be a better pick than the usual household name.,AAPL,-0.014705,Neutral
20250124T134200,NFLX Beats Q4 Expectations: Here's Why the Stock Could Hit $1100 Soon,"Netflix's Q4 blowout, 19 million new subs and 29% margin target for 2025 signal a major upside ahead. Time to stream some profits with this entertainment powerhouse.",AAPL,0.213401,Somewhat-Bullish
20250124T150031,"Inquiry Into Apple's Competitor Dynamics In Technology Hardware, Storage & Peripherals Industry - Apple  ( NASDAQ:AAPL ) ","In the dynamic and fiercely competitive business environment, conducting a thorough analysis of companies is crucial for investors and industry enthusiasts. In this article, we will perform an extensive industry comparison, evaluating Apple AAPL in relation to its major competitors in the ...",AAPL,0.38786,Bullish
20250124T165026,"AI Agents To Replace Humans, Best Market Start For A New President Since 1985, Trump Bans Digital Dollar, Biggest Hike In Japan In 18 Years - SPDR S&P 500  ( ARCA:SPY ) ","To gain an edge, this is what you need to know today. An enlarged chart of SPDR S&P 500 ETF Trust SPY which represents the benchmark stock market index S&P 500 ( SPX ) . Please be extra careful, if you are trading new cryptos.",AAPL,0.204901,Somewhat-Bullish
20250124T171000,Questions and Answers on Your 5 Favorite Stocks,"Tracey Ryniec, Zacks Senior Stock Strategist, answers your questions about your favorite stocks that were left in the YouTube comments.",AAPL,0.256879,Somewhat-Bullish
20250124T172440,"TikTok Ban Sparks Divide: Oracle Backs Trump While Apple, Google Play It Safe - Alphabet  ( NASDAQ:GOOGL ) , Oracle  ( NYSE:ORCL ) ","Apple Inc. AAPL, Alphabet Inc's GOOG GOOGL Google and Oracle Corp ORCL remain divided in their approaches to TikTok as their vested interests play out. TikTok's cloud service provider, Oracle hailed Trump's potential softer take on the ByteDance social media platform.",AAPL,0.01597,Neutral
20250124T175425,"Apple Q1 Earnings Might Not Miss A Beat, Even As iPhone Sales Stumble: Analyst - Apple  ( NASDAQ:AAPL ) , Qualcomm  ( NASDAQ:QCOM ) ","Apple Inc AAPL may be facing a softer iPhone cycle, but at least one analyst isn't worried. Despite trimming iPhone sales estimates for the year, Bank of America Securities' Wamsi Mohan remains bullish. He reiterated a Buy rating with a $253 price target-just slightly lower than before.",AAPL,0.232521,Somewhat-Bullish
20250125T003600,Mag 7 Earnings On Deck: A Closer Look,"Four Mag 7 members are on the reporting docket for next week, with many other S&P 500 members on the docket as well. What can investors expect?",AAPL,-0.031618,Neutral
20250125T013956,"Apple Co-Founder Steve Jobs In 1981 Said Homes Weren't Ready For Personal Computers - Three Years Later, Cupertino Launched The Macintosh And Made History - Apple  ( NASDAQ:AAPL ) ","In 1981, Steve Jobs expressed skepticism about the home market for personal computers. Just three years later, Apple Inc. AAPL unveiled the Macintosh, a device that not only changed computing but also set the stage for the tech giant's dominance in consumer tech.",AAPL,0.06957,Neutral
20250125T041800,"Gaming Market to Grow by USD 100.8 Billion  ( 2025-2029 ) , Driven by AR and VR Game Adoption, Report Highlights AI Impact on Market Trends - Technavio","NEW YORK, Jan. 24, 2025 /PRNewswire/ -- Report on how AI is redefining market landscape - The global gaming market size is estimated to grow by USD 100.8 billion from 2025-2029, according to Technavio. The market is estimated to grow at a CAGR of 8.4% during the forecast period.",AAPL,0.107158,Neutral
20250125T074308,"Apple's iPhone 17 Dynamic Island To Remain 'Largely Unchanged' Despite Prior Rumors, Says Top Analyst - Apple  ( NASDAQ:AAPL ) ","A prominent Apple Inc. AAPL analyst on Friday contradicted earlier rumors about the iPhone 17's Dynamic Island, suggesting that it will remain largely unchanged. What Happened: Apple analyst Ming-Chi Kuo, in a post on X revealed that the size of the Dynamic Island will stay ""largely unchanged"" in ...",AAPL,0.142208,Neutral
20250125T082253,"Apple Shakes Up AI Division, Taps Veteran Kim Vorrath To Bolster Siri - Apple  ( NASDAQ:AAPL ) ","Apple Inc. AAPL has taken a major step to strengthen its AI and Siri capabilities by making a notable leadership change. The company has appointed Kim Vorrath, a veteran executive with years of experience at Apple, as a senior leader in its artificial intelligence and machine learning division.",AAPL,0.055604,Neutral
20250125T082500,Billionaire Steven Cohen Sells Apple Stock and Buys a Little-Known AI Stock Up 500% in Less Than 3 Years,"Steven Cohen runs Point72 Asset Management, a hedge fund that has earned $38 billion in profits since its inception in 1992. That makes him the 12th-most successful hedge fund manager in history, according to LCH Investments.In the third quarter, Cohen sold his entire stake in Apple ( NASDAQ: ...",AAPL,0.14514,Neutral
20250125T090634,Apple Stock Nears Critical Level Amid Worst Start Since 2008: 'When You Get Names Starting To Flirt With It...You Kind Of Lose Confidence' - Apple  ( NASDAQ:AAPL ) ,"Apple Inc. AAPL has had a turbulent beginning to 2025, with its shares approaching a significant level that could signal further losses if breached, according to analysts. What Happened: Since the start of the year, the tech behemoth's stock has plummeted by 11%, making it the weakest performer ...",AAPL,0.225146,Somewhat-Bullish
20250125T091352,"Epic Games Expands Mobile Store, Launches Free Games Program: To Cover iOS Developer Fees","In a significant move, Epic Games is expanding its mobile game store to include nearly 20 third-party games on Android worldwide and iOS within the European Union. This expansion is accompanied by the launch of a free games program on mobile platforms.",AAPL,0.075597,Neutral
20250125T105200,Warren Buffett Could Make Over $3 Billion in Dividend Income in 2025 From These 5 Stocks,"The late Senator Everett Dirksen once reportedly said, ""A billion here, a billion there, and pretty soon you're talking about real money."" With that quote in mind, Warren Buffett's dividend income this year will be real money. Technically, the dividend income will belong to Berkshire Hathaway.",AAPL,0.205744,Somewhat-Bullish
20250125T123000,This Chip Stock Could Be the Best Investment of the Decade,"Finding stocks that are among the top investments of the decade isn't easy. Many trends can rise and fall, causing some stocks to falter after a few years. However, one industry with obvious staying power that will benefit no matter how big other trends get is chip companies.While I believe ...",AAPL,0.0,Neutral
20250125T160048,"Consumer Tech News  ( Jan 20-Jan 24 ) : Trump Revokes Biden's AI Policies, Meta Launches New 'Edits' App To Lure TikTok Users & More - Apple  ( NASDAQ:AAPL ) , Electronic Arts  ( NASDAQ:EA ) ",President Donald Trump on Monday revoked former President Joe Biden's comprehensive executive order on artificial intelligence as part of his first actions in office.,AAPL,0.180597,Somewhat-Bullish
20250125T233200,Apple Receives Rare Underperform Rating from Wall Street Analyst. Is It Time to Sell the Stock?,"In a rare move, analysts at Jefferies downgraded one of the largest companies in the world, Apple ( NASDAQ: AAPL ) , to underperform. Wall Street analysts are known for being bullish, so underperform and sell ratings tend to make up only a small percentage of overall analyst ratings.For its part, ...",AAPL,0.168119,Somewhat-Bullish
20250126T115100,Is This Simple Index Fund a Millionaire Maker?,How much money do you need to invest in a market-beating index fund to make a million dollars? How long will it take? Does this alternative Vanguard ETF have what it takes to make you a millionaire? Let's take a look.,AAPL,0.062348,Neutral
20250126T120043,"Apple's Rough Start To 2025, Stock Woes, AI Shakeups, And More: This Week In Appleverse - Apple  ( NASDAQ:AAPL ) ","As we move further into 2025, Apple Inc. AAPL is making headlines, but not all for the right reasons. The tech giant has had a turbulent start to the year, with its stock performance causing concern among investors.",AAPL,0.011209,Neutral
20250126T134400,Warren Buffett Has $69.9 Billion Invested in This Dividend-Paying Stock. Is It a Buy Now?,"There are many ways to get rich on Wall Street, but none seem as reliable as the strategies employed by Warren Buffett. The legendary investor took control of Berkshire Hathaway ( NYSE: BRK.A ) ( NYSE: BRK.B ) in 1965. Over the past six decades, the stock has delivered a 19.6% average annual ...",AAPL,0.320873,Somewhat-Bullish
20250126T140042,"Elon Musk Questions Stargate Funding, Sam Altman's Flip Flop On Trump, OpenAI's Operator: This Week In AI - Rigetti Computing  ( NASDAQ:RGTI ) ","As the weekend wraps up, we've seen a flurry of activity in the tech sector. From leadership changes at Apple Inc. AAPL to skyrocketing shares at Rigetti Computing RGTI, and the unveiling of a new AI agent by OpenAI, there's plenty to catch up on. Let's dive into the top stories.",AAPL,0.437902,Bullish
20250126T212020,"Apple's Augmented Reality Gamble Faces Challenges As Rivals Surge Ahead In AI and Design - Alphabet  ( NASDAQ:GOOGL ) , Apple  ( NASDAQ:AAPL ) ","Apple faces delays in launching AR glasses as rivals Meta and Google advance. Samsung's Galaxy S25 features advanced AI, surpassing Apple's current capabilities. Get Pro-Level Earnings Insights Before the Market Moves Meta Platforms Inc. META and Alphabet Inc.",AAPL,0.374061,Bullish
20250127T024611,Apple AirPods With Cameras? Rumors Persist About Next-Gen Features - Apple  ( NASDAQ:AAPL ) ,"Apple Inc. AAPL reportedly continues to explore AirPods with tiny infrared cameras. What Happened: In his latest ""Power On"" newsletter, Bloomberg columnist Mark Gurman fleetingly mentioned camera-equipped AirPods while reporting about Cupertino's wearables development.",AAPL,0.027604,Neutral
20250127T054542,"Despite Peter Thiel Ties, JD Vance Warns Of Big Tech Billionaires' Excessive Clout: They've Got 'Too Much Power' - Apple  ( NASDAQ:AAPL ) , Amazon.com  ( NASDAQ:AMZN ) ","Vice President JD Vance, who was backed by PayPal co-founder Peter Thiel, has voiced his concerns about the influence of big tech companies, asserting that these companies wield ""too much power.""",AAPL,0.0,Neutral
20250127T083100,"Television Market to Grow by USD 73.1 Billion  ( 2025-2029 ) , Driven by Innovation and Premiumization, Report Highlights AI Impact on Market Trends - Technavio","NEW YORK, Jan. 27, 2025 /PRNewswire/ -- Report on how AI is redefining market landscape - The global television market size is estimated to grow by USD 73.1 billion from 2025-2029, according to Technavio. The market is estimated to grow at a CAGR of over 8.2% during the forecast period.",AAPL,0.0,Neutral
20250127T083303,"iOS 18.4 Preview: Updates To Siri, More Languages For Apple Intelligence, And Robot Vacuum Support - Everything We Know So Far - Apple  ( NASDAQ:AAPL ) ","Apple Inc. AAPL reportedly plans to release the iOS 18.4 update in April, following the public rollout of iOS 18.3 this week. What Happened: While the beta testing for iOS 18.4 has yet to begin, early details reveal several updates including a smarter Siri, expanded language support for Apple ...",AAPL,0.440818,Bullish
20250127T084200,"Music Production Software Market to Grow by USD 432.8 Million  ( 2025-2029 ) , Driven by Rising Musicians and Artists, Report Highlights AI Impact on Market Trends - Technavio","NEW YORK, Jan. 27, 2025 /PRNewswire/ -- Report on how AI is redefining market landscape - The global music production software market size is estimated to grow by USD 432.8 million from 2025-2029, according to Technavio. The market is estimated to grow at a CAGR of almost 7.7% during the forecast ...",AAPL,0.04044,Neutral
20250127T090500,2 Vanguard ETFs to Buy With $500 and Hold Forever,"When you think of investing in stocks, you probably think of considering each company one by one, researching that particular player -- and then buying if the investment case looks solid. And this is a key part of building your path to wealth.",AAPL,0.114821,Neutral
20250127T092645,Apple's iPad Turns 15 Today: Here's A Throwback To When Steve Jobs Explained Called It The 'Third Category' After Phones And Notebooks - Apple  ( NASDAQ:AAPL ) ,"Fifteen years ago today, Apple Inc. AAPL co-founder Steve Jobs introduced the iPad, marking the start of a device that would forever change how we use technology. What Happened: On Jan. 27, 2010, Jobs introduced the iPad as a ""magical and revolutionary device.""",AAPL,0.205331,Somewhat-Bullish
20250127T095100,Meet the Stock Warren Buffett Has the Utmost Confidence In -- He's Been a Buyer for 24 of the Last 25 Quarters,The roughly $78 billion the Oracle of Omaha has spent buying this stock since mid-2018 decisively signals it's his favorite.,AAPL,0.133703,Neutral
20250127T104100,Should You Buy Berkshire Hathaway Stock Before Jan. 30?,"To say that Berkshire Hathaway ( NYSE: BRK.A ) ( NYSE: BRK.B ) has been a big winner for investors over the long term would be an understatement. Between 1964 and 2023, Berkshire's overall gain was a jaw-dropping 4,384,748% -- more than 140 times greater than the S&P 500's gain during the period.",AAPL,0.375061,Bullish
20250127T104300,"Augmented Reality and Virtual Reality Market to grow by USD 442.9 Billion  ( 2024-2028 ) , Rising Demand for AR and VR Tech Drives Growth, Report Highlights AI Impact - Technavio","NEW YORK, Jan. 27, 2025 /PRNewswire/ -- Report on how AI is redefining market landscape - The global augmented reality and virtual reality market size is estimated to grow by USD 442.9 billion from 2024-2028, according to Technavio. The market is estimated to grow at a CAGR of 50.22% during the ...",AAPL,0.044562,Neutral
20250127T112007,Should BNY Mellon US Large Cap Core Equity ETF  ( BKLC )  Be on Your Investing Radar?,Style Box ETF report for ...,AAPL,0.070327,Neutral
20250127T114436,"US Stock Futures Tumble As DeepSeek Buzz Jolts Big Tech: Expert Says The Chinese AI Model Is Yet To Prove Its Viability At Lower Cost In Long Term - Apple  ( NASDAQ:AAPL ) , Amazon.com  ( NASDAQ:AMZN ) ","U.S. stock futures dropped sharply on Monday after the rise in the popularity of DeepSeek, a Chinese artificial intelligence model that demonstrates high performance at a significantly lower cost.",AAPL,-0.011625,Neutral
