published_date,title,summary,ticker,ticker_sentiment_score,ticker_sentiment_label
20250225T140014,Apple Inc.  ( AAPL )  Is a Trending Stock: Facts to Know Before Betting on It,"Zacks.com users have recently been watching Apple (AAPL) quite a bit. Thus, it is worth knowing the facts that could determine the stock's prospects.",AAPL,0.172898,Somewhat-Bullish
20250225T150052,"Analyzing Apple In Comparison To Competitors In Technology Hardware, Storage & Peripherals Industry - Apple  ( NASDAQ:AAPL ) ","In today's rapidly changing and fiercely competitive business landscape, it is vital for investors and industry enthusiasts to carefully evaluate companies. In this article, we will perform a comprehensive industry comparison, evaluating Apple AAPL against its key competitors in the Technology ...",AAPL,0.416197,Bullish
20250225T151835,How To Trade The SPY And Top Tech Stocks Today?,"Good Morning Traders! In today's Market Clubhouse Morning Memo, we will discuss SPY, QQQ, AAPL, MSFT, NVDA, GOOGL, META, and TSLA. Our proprietary formula, exclusive to Market Clubhouse, dictates these price levels. This dynamic equation takes into account price, volume, and options flow.",AAPL,-0.005406,Neutral
20250225T165410,"Momo Stocks Sell Off As Trump Hopium Meets Reality, All Eyes On Nvidia, China Caught Cutting Cable","To gain an edge, this is what you need to know today. Please click here for an enlarged chart of Hims & Hers Health Inc ( HIMS ) . In many areas, hopium from President Trump is justified. However, the momo crowd has taken it to an extreme.",AAPL,0.110005,Neutral
20250225T192254,"STMicroelectronics Faces Leadership Shakeup, Italy Seeks New CEO Amid Semiconductor Struggles - STMicroelectronics  ( NYSE:STM ) ","Italy considers replacing STMicroelectronics CEO after weak performance and struggles in auto and industrial semiconductor demand. STMicroelectronics stock dropped 30% in a year as revenue slumped, prompting concerns over leadership and industry downturn.",AAPL,-0.477751,Bearish
20250225T204904,Apple Shareholders Uphold DEI Programs Amid Corporate Rollbacks - Apple  ( NASDAQ:AAPL ) ,"Apple shareholders voted to uphold the company's DEI programs. The proposal argued that DEI initiatives could lead to discrimination and pose financial risks. Get access to your new suite of high-powered trading tools, including real-time stock ratings, insider trades, and government trading ...",AAPL,-0.245998,Somewhat-Bearish
20250225T222402,"Masimo Tops EPS, Revenue Expectations","Masimo impressed with a robust earnings report driven by its healthcare segment, despite challenges from non-healthcare operations.",AAPL,0.087484,Neutral
20250226T032126,Apple's AI Dictation Bug That Replaces 'Racist' With 'Trump' Sparks Controversy - Cupertino Says Its Phonetic Overlap - Apple  ( NASDAQ:AAPL ) ,"Apple Inc. AAPL is working to fix a bug in its AI-powered dictation system after iPhone users reported that saying ""racist"" caused the word ""Trump"" to appear briefly before correcting itself. What Happened: The issue was first noticed on Tuesday, with reports spreading rapidly after a viral ...",AAPL,-0.322958,Somewhat-Bearish
20250226T043516,"AMC CEO Says Apple And Amazon Are Warming Up To Theatrical Releases But This Streaming Giant Still Isn't Convinced - Apple  ( NASDAQ:AAPL ) , AMC Enter Hldgs  ( NYSE:AMC ) ","On Tuesday, AMC Entertainment Holdings Inc. AMC CEO Adam Aron said that the world's biggest streamers are rethinking their approach to the big screen-Apple Inc. AAPL and Amazon.com, Inc. AMZN are fully on board, but Netflix Inc. NFLX still needs convincing.",AAPL,0.262556,Somewhat-Bullish
20250226T074759,"Apple's Smart Doorbell May Feature MagSafe, Face ID, And Smart Lock Integration: But You Won't See It Anytime Soon - Apple  ( NASDAQ:AAPL ) ",Apple Inc. AAPL is reportedly developing a smart home doorbell with MagSafe and Face ID - though it may not hit the market until late 2025 or beyond. What Happened: A new leak from X user Kosutami suggests that Apple's rumored smart doorbell could feature MagSafe.,AAPL,0.399488,Bullish
20250226T084718,"China Says TSMC Could Become 'United States Semiconductor Manufacturing Co.' As Trump Pushes US Chipmaking - Apple  ( NASDAQ:AAPL ) , Intel  ( NASDAQ:INTC ) ","China accused Taiwan of attempting to surrender its prized semiconductor industry to the United States as a ""souvenir"" to gain political support, amid reports that Taiwan Semiconductor Mfg. Co. Ltd. TSM has been in talks for a stake in Intel Corp INTC.",AAPL,0.082802,Neutral
20250226T095100,Warren Buffett's $173 Billion Warning to Wall Street Can't Be Ignored Any Longer,This once-silent warning has become deafening over the last nine quarters.,AAPL,0.128227,Neutral
20250226T112006,Is John Hancock Multifactor Large Cap ETF  ( JHML )  a Strong ETF Right Now?,Smart Beta ETF report for ...,AAPL,0.063439,Neutral
20250226T120357,PayPal Shifts Focus From Payments to Commerce Amid Growth Strategy- Analysts Urge Caution - PayPal Holdings  ( NASDAQ:PYPL ) ,"PayPal Holdings Inc. PYPL has made several announcements and shared its growth strategy for the upcoming years, on its investor day on Tuesday attracting mixed response from analysts.",AAPL,-0.120317,Neutral
20250226T134500,Prediction: This Artificial Intelligence  ( AI )  Company Will Split Its Stock in 2025,"Stock splits, particularly in the tech sector, have gained attention in recent months. As stocks such as Nvidia and Broadcom rose above $1,000 per share, they each executed stock splits, probably in an attempt to attract more prospective investors.Amid this paradigm, it might surprise some ...",AAPL,-0.001176,Neutral
20250226T160600,"Spotify Surges 133% in a Year: Buy, Sell, or Hold the Stock?","Given SPOT's price rise, we analyze its current position to find out whether investors should buy it, hold it, or book profits.",AAPL,0.027958,Neutral
20250226T174918,What's Going On With Applied Materials  ( AMAT )  Shares? - Applied Mat  ( NASDAQ:AMAT ) ,"Shares of Applied Materials are trading higher by 2.6% during Wednesday's session. Investors anticipate Q4 earnings from NVIDIA after the market close. Get 5 stock picks identified before their biggest breakouts, identified by the same system that spotted Insmed, Sprouts, and Uber before their ...",AAPL,0.054673,Neutral
20250226T181453,Spotify CEO Wants EU To Penalize Apple For Defying Regulations - Spotify Technology  ( NYSE:SPOT ) ,"Spotify CEO pushes EU to crack down on Apple, accusing the tech giant of exploiting its influence to bypass Big Tech rules Daniel Ek escalates Spotify's battle against Apple, urges regulators to enforce penalties over alleged App Store violations",AAPL,-0.291521,Somewhat-Bearish
20250226T213310,Apple Stock To Get A Boost From Indonesia? iPhone 16 Ban Could Be Over Soon - Apple  ( NASDAQ:AAPL ) ,Apple could be nearing a return to Indonesia for the iPhone 16 after a multi-month ban. The return could boost iPhone 16 sales and see Apple return to trying to take premium smartphone market share.,AAPL,0.280417,Somewhat-Bullish
20250227T032937,"Tulsi Gabbard Slams UK's Apple Encryption Demand As 'Egregious Violation' Of Americans' Privacy, Warns Of Cyber Threats - Apple  ( NASDAQ:AAPL ) ","U.S. Director of National Intelligence Tulsi Gabbard has condemned the United Kingdom's demand for Apple Inc. AAPL to create a ""backdoor"" to encrypted iCloud accounts, calling it a ""clear and egregious violation of Americans' privacy and civil liberties.""",AAPL,0.05558,Neutral
20250227T074149,"YouTube Surpasses Spotify With 1 Billion Monthly Podcast Users. CEO Pledges Enhanced Monetization For Creators - Alphabet  ( NASDAQ:GOOG ) , Apple  ( NASDAQ:AAPL ) ","Alphabet Inc.'s GOOG GOOGL YouTube revealed that it has reached over 1 billion monthly active viewers of podcast content, thus outperforming Spotify Technology SA SPOT. What Happened: In a blog post published on Thursday, YouTube said it is now the most popular service for podcast listening in ...",AAPL,0.128482,Neutral
20250227T095100,Warren Buffett's Annual Letter Shares 4 of the Most Chilling Words Investors Will Ever Witness,One of Wall Street's most unwavering long-term optimists just bluntly leveled with investors.,AAPL,0.002296,Neutral
20250227T112900,3 Driehaus Mutual Funds for Long-term Returns,"Invest in Driehaus mutual funds like DVSMX, DMAGX and DRESX for a diversified portfolio.",AAPL,0.051832,Neutral
20250227T131756,"Market To Navigate Nvidia Post-Earnings Analysis, Key Economic Events - NVIDIA  ( NASDAQ:NVDA ) ","Good Morning Traders! In today's Market Clubhouse Morning Memo, we will discuss SPY, QQQ, AAPL, MSFT, NVDA, GOOGL, META, and TSLA. Our proprietary formula, exclusive to Market Clubhouse, dictates these price levels. This dynamic equation takes into account price, volume, and options flow.",AAPL,0.078,Neutral
20250227T134500,"Prediction: This Artificial Intelligence  ( AI )  Stock -- a 1,020% Gainer Since Its IPO -- Won't Split Its Stock in 2025. Here's Why","Palantir stock is up by more than 1,000% in less than five years.",AAPL,0.184,Somewhat-Bullish
20250227T135908,"February Fever: Retail Investors 'Buy-The-Dip' As Hedge Funds Rebuild Magnificent Seven Bets - Invesco QQQ Trust, Series 1  ( NASDAQ:QQQ ) , ProShares UltraPro QQQ  ( NASDAQ:TQQQ ) ","Retail investors poured $79 billion into equity ETFs in February, continuing their aggressive 'buy the dip' strategy. Hedge funds are quietly rebuilding MAG 7 positions after trimming exposure in late 2024. Every week, our Whisper Index uncovers five overlooked stocks with big breakout potential.",AAPL,0.060241,Neutral
20250227T150057,"Understanding Apple's Position In Technology Hardware, Storage & Peripherals Industry Compared To Competitors - Apple  ( NASDAQ:AAPL ) ","In today's rapidly changing and fiercely competitive business landscape, it is essential for investors and industry enthusiasts to thoroughly analyze companies. In this article, we will conduct a comprehensive industry comparison, evaluating Apple AAPL against its key competitors in the ...",AAPL,0.344403,Somewhat-Bullish
20250227T161833,Taiwan Semiconductor Faces Government Scrutiny on Overseas Ventures Amid Intel Stake Rumors - Taiwan Semiconductor  ( NYSE:TSM ) ,Taiwan says TSMC needs government approval for overseas joint ventures but allows advanced chip production outside China TSMC invests $65B in U.S. factories as Taiwan defends semiconductor industry amid geopolitical tensions Our government trade tracker caught Pelosi's 169% AI winner.,AAPL,-0.013579,Neutral
20250301T000018,"Wall Street Is Shying Away From The 'Mag-7' As $1.4 Trillion In Value Leaks Out - Apple  ( NASDAQ:AAPL ) , Amazon.com  ( NASDAQ:AMZN ) ","Tech giants that have dominated Wall Street for two years are losing their grip, with the so-called Magnificent Seven stocks shedding about $1.4 trillion in market value since December, Bloomberg reported Tuesday.",AAPL,0.041402,Neutral
20250301T110000,3 Can't-Miss Takeaways From Warren Buffett's Letter to Berkshire Hathaway Shareholders,Berkshire Hathaway ( NYSE: BRK.A ) ( NYSE: BRK.B ) published its 2024 shareholder letter on Saturday.Continue reading ...,AAPL,0.251872,Somewhat-Bullish
20250301T120049,"This Bill Gates 'Mistake' Cost Microsoft A $400 Billion Opportunity, According To Android Co-Founder: 'Sorry, Bill' - Alphabet  ( NASDAQ:GOOG ) , Apple  ( NASDAQ:AAPL ) ","Microsoft Corp. MSFT co-founder Bill Gates admitted to a significant oversight that, according to an Android co-founder, cost the Windows-maker a $400 billion opportunity in the mobile sector.",AAPL,0.180129,Somewhat-Bullish
20250301T131300,"Should You Buy Bitcoin While It's Under $90,000?","Bitcoin ( CRYPTO: BTC ) investors were taken on quite a ride in 2024. The cryptocurrency more than doubled in under a year, smashing past previous all-time highs to finally surpass $100,000, a milestone few could dream of just a decade before.",AAPL,0.123983,Neutral
20250301T160048,"Consumer Tech News  ( Feb 24-Feb 28 ) : Australian Regulators Fined Telegram A$1 Million, Apple May Integrate Google Gemini AI Into Siri & More - Apple  ( NASDAQ:AAPL ) , AMC Entertainment Hldgs  ( NYSE:AMC ) ","Grok, the AI chatbot developed by xAI briefly halted responses that suggested Elon Much and Donald Trump were spreading misinformation. Apple may integrate Google Gemini AI into Siri for improved responses. Our government trade tracker caught Pelosi's 169% AI winner.",AAPL,0.324956,Somewhat-Bullish
20250302T120043,"Apple's $500 Billion Investment, Age Detection, Trump AI Dictation Bug, Smart Doorbells, And More: This Week In Appleverse - Apple  ( NASDAQ:AAPL ) ","As we wrap up another eventful week, it's clear that Apple Inc. AAPL has been making waves with a series of intriguing developments. From age detection technology to smart doorbells, the tech giant has kept us on our toes. Let's delve into the top stories that made headlines.",AAPL,0.210586,Somewhat-Bullish
20250302T185026,"$21 Trillion Wealth-Creating Stocks Are Still Undervalued - Three Big Bargains To Buy Now - Apple  ( NASDAQ:AAPL ) , Amazon.com  ( NASDAQ:AMZN ) ","With economic moats and innovative technologies, these top-performing stocks offer a potential bargain for long-term investors. Every week, our Whisper Index uncovers five overlooked stocks with big breakout potential. Get the latest picks today before they gain traction.",AAPL,0.168335,Somewhat-Bullish
20250302T200800,How Are 9 Out of the 11 Stock Market Sectors Outperforming the S&P 500 in 2025?,"There are plenty of ways to categorize stocks. Some investors think of growth stocks versus value or dividend stocks. Or megacap, large-cap, mid-cap, and small-cap if you sort by market capitalization. There's also a more formal organization technique based on stock market sectors.According to ...",AAPL,-0.074032,Neutral
20250302T213044,Apple's AI Crisis: Falling Behind In The AI Race? - Amazon.com  ( NASDAQ:AMZN ) ,"Apple races against time as Siri's next upgrade in May becomes a make-or-break moment in the AI feud. Amazon's Alexa+ leapfrogs Apple's Siri, revealing a stark gap in the tech giant's AI capabilities. Every week, our Whisper Index uncovers five overlooked stocks with big breakout potential.",AAPL,-0.077712,Neutral
20250303T020249,"Google And China's Honor Deepen AI Partnership As Huawei Spin-Off Takes On Apple And Samsung With $10 Billion Investment - Alphabet  ( NASDAQ:GOOG ) , Apple  ( NASDAQ:AAPL ) ","Honor has ramped up its AI ambitions with a $10 billion investment over the next five years, alongside a deeper partnership with Alphabet Inc.'s GOOG GOOGL Google, as it looks to compete with Apple Inc. AAPL and Samsung Electronics Co. SSNLF in the global smartphone market.",AAPL,0.288443,Somewhat-Bullish
20250303T062803,"Trump Blasts UK's Apple Encryption Order, Warns Against 'Grave' Privacy Violations: 'That's Something You Hear About With China' - Apple  ( NASDAQ:AAPL ) ","President Donald Trump has strongly criticized the U.K. government's demand for Apple Inc. AAPL to create a backdoor into its encrypted cloud storage, comparing the move to authoritarian surveillance tactics used in China.",AAPL,0.095218,Neutral
20250303T100000,"Berkshire Hathaway's ""Extraordinary Cash Position"" Is No Big Deal, According to Warren Buffett","Every year, investors eagerly await Berkshire Hathaway's ( NYSE: BRK.A ) ( NYSE: BRK.B ) annual report. The highlight is Warren Buffett's shareholder letter, in which he shares his folksy wisdom about investing and the company he heads.",AAPL,0.060544,Neutral
20250303T112007,Is iShares MSCI USA Quality Factor ETF  ( QUAL )  a Strong ETF Right Now?,Smart Beta ETF report for QUAL ...,AAPL,0.060445,Neutral
20250303T112007,Should Vanguard S&P 500 ETF  ( VOO )  Be on Your Investing Radar?,Style Box ETF report for ...,AAPL,0.072576,Neutral
20250303T112100,Warren Buffett Has Sold Over 950 Million Shares of Apple and Bank of America. But the Billionaire Has Made a Killing on 1 Stock He Hasn't Touched in 27 Years,"2024 turned out to be a bit of an odd year for Warren Buffett and his company Berkshire Hathaway ( NYSE: BRK.A ) ( NYSE: BRK.B ) . Berkshire's stock performed well, with class B shares generating a 27% return and beating the broader market's 23% return.However, Buffett made many moves indicating ...",AAPL,0.032867,Neutral
20250303T114500,Prediction: 3 Stocks That'll Be Worth More Than Apple 5 Years From Now,"Apple ( NASDAQ: AAPL ) is the world's largest company by market capitalization, so it takes a lot for companies to surpass it in terms of valuation. However, I think that it's possible. The number of companies in a position to pass Apple is relatively few, based solely on Apple's sheer $3.6 ...",AAPL,0.490988,Bullish
20250303T130000,"More Power, Less Bulk: Mophie's New Powerstation Lineup Delivers High-Density, High-Capacity Charging","SALT LAKE CITY, March 03, 2025 ( GLOBE NEWSWIRE ) -- Mophie, a leading brand in power and innovator of intelligent solutions for mobile devices, is redefining mobile charging with the launch of four powerful new devices: Powerstation Mini, Powerstation, Powerstation Pro, and Powerstation Ultra.",AAPL,0.115844,Neutral
20250303T141500,Warren Buffett Is Still Holding His Apple Stock: Should You?,Warren Buffett has stopped trimming his Apple ( NASDAQ: AAPL ) position. The billionaire from Omaha kept his largest position for Berkshire Hathaway unchanged in the fourth quarter after dumping most of his ownership in the first three quarters of 2024.,AAPL,0.298994,Somewhat-Bullish
20250303T144603,Behind the Scenes of Apple's Latest Options Trends - Apple  ( NASDAQ:AAPL ) ,"Financial giants have made a conspicuous bullish move on Apple. Our analysis of options history for Apple AAPL revealed 21 unusual trades. Delving into the details, we found 71% of traders were bullish, while 14% showed bearish tendencies.",AAPL,0.237525,Somewhat-Bullish
20250303T161400,Rule Breaker Investing Mailbag: Simple Stocks,"Peter Lynch taught us to buy what we know. Can successful investing be that simple? And if we know and love the companies we own, how should we go about selling them? How are we supposed to remember why we bought these stocks in the first place?",AAPL,0.026304,Neutral
20250303T162900,Warren Buffett's State of the Market,"Berkshire's cash hoard is approaching ""Dr. Evil"" levels.",AAPL,0.087626,Neutral
20250303T182200,"The ""Apple of Public Safety""","Axon Enterprise is facing new questions about its competition, but the earnings continue to look strong.",AAPL,0.101594,Neutral
20250303T183024,"Berkshire Hathaway Hits $1.07 Trillion Market Cap, Surpassing Tesla - Earnings Shock and Tesla's Decline Highlight Changing Markets - Apple  ( NASDAQ:AAPL ) , Amazon.com  ( NASDAQ:AMZN ) ","On Monday, Warren Buffett's Berkshire Hathaway BRK BRK.B ) ) pulled ahead of Elon Musk's Tesla TSLA in market value, showing just how much earnings matter in the stock market.",AAPL,0.060646,Neutral
20250303T200400,Buy Taiwan Semiconductor  ( TSM )  Stock for Expansion Plans in the U.S.?,"Taiwan Semiconductor (TSM) is making headlines on Monday, with the chip giant set to invest $100 billion for manufacturing plants in the United States.",AAPL,0.32575,Somewhat-Bullish
20250303T234100,Markets Pull Back Late on New Tariff Talk,"Today's fall was steady and modest until this afternoon, when it was announced +25% tariffs are indeed being levied onto our direct neighbors Canada and Mexico.",AAPL,0.028209,Neutral
20250304T021816,Tim Cook Says 'There's Something In The Air' - New MacBook Air Or A Surprise Product Launch On The Cards? - Apple  ( NASDAQ:AAPL ) ,"On Monday, Apple Inc. AAPL CEO Tim Cook sparked speculation with a cryptic teaser hinting at a new ""Air"" product launch this week, leaving fans wondering whether it's the highly anticipated MacBook Air or something entirely unexpected.",AAPL,0.156701,Somewhat-Bullish
20250304T080400,"Zacks Investment Ideas feature highlights Taiwan, Apple, Nvidia and AMD","Taiwan, Apple, Nvidia and AMD have been highlighted in this Investment Ideas article.",AAPL,0.30482,Somewhat-Bullish
20250304T090400,Apple's $500 Billion Investment in America: Is the Stock a Buy?,"The reshoring of manufacturing to North America is becoming a huge theme throughout corporate America. Whether their management teams are acting to avoid the impact of tariffs or because it makes sense to them on broader business and geopolitical levels, numerous companies recently made major ...",AAPL,0.249249,Somewhat-Bullish
20250304T100600,"2 Magnificent Warren Buffett Stocks That Make for Screaming Buys in March, and 1 to Avoid","Two historically inexpensive stocks in Berkshire Hathaway's $297.5 billion portfolio are ripe for the picking, while the Oracle of Omaha's top holding is sending all the wrong signals.",AAPL,0.198835,Somewhat-Bullish
20250304T104300,"Warren Buffett Just Sold 4 Bank Stocks, but Hasn't Unloaded a Single Share of These 2","Warren Buffett has been a fan of the banking industry for many years. Out of the roughly 40 stocks in Berkshire Hathaway's ( NYSE: BRK.A ) ( NYSE: BRK.B ) closely watched portfolio, six of them are banks -- including two of the three largest positions.However, Berkshire has significantly reduced ...",AAPL,0.160596,Somewhat-Bullish
20250304T112005,Should Fidelity Nasdaq Composite Index ETF  ( ONEQ )  Be on Your Investing Radar?,Style Box ETF report for ...,AAPL,0.068387,Neutral
20250304T112006,Should Vanguard S&P 500 Growth ETF  ( VOOG )  Be on Your Investing Radar?,Style Box ETF report for ...,AAPL,0.069101,Neutral
20250304T112007,Is FlexShares Quality Dividend ETF  ( QDF )  a Strong ETF Right Now?,Smart Beta ETF report for ...,AAPL,0.041971,Neutral
20250304T112009,"Taiwan Semiconductor Doubles Down On US Chipmaking, Plans $165 Billion Investment - Taiwan Semiconductor  ( NYSE:TSM ) ","TSMC boosts U.S. investment to $165B, adding 3 new fabs, 2 packaging sites & an R&D center for advanced semiconductor manufacturing. Expansion to create 40K construction jobs, tens of thousands of high-tech roles & drive $200B+ in economic output over the next decade.",AAPL,0.086262,Neutral
20250304T123000,Which Will Win the Race to $5 Trillion: Apple or Nvidia Stock?,"Although the world has never seen a $5 trillion company, there is a competitive race between Apple ( NASDAQ: AAPL ) and Nvidia ( NASDAQ: NVDA ) . Apple has a large lead with its $3.6 trillion market cap, but Nvidia isn't far behind with a $3 trillion market cap.",AAPL,0.397752,Bullish
20250304T123000,Apple Stock Investors: Here's What You Need to Know,"Apple ( NASDAQ: AAPL ) boasts one of the highest customer satisfaction ratings of any company.*Stock prices used were the afternoon prices of Feb. 27, 2025. The video was published on March 1, 2025.Continue reading ...",AAPL,-0.601535,Bearish
20250304T130000,Trump Tariffs & Retaliatory Moves Put These ETF Areas in Focus,"A second round of tariffs imposed on Canada, China and Mexico by President Donald Trump takes effect today. These ETF areas would be impacted.",AAPL,0.0,Neutral
20250304T130800,"3 Dividend Stock ETFs to Buy With $2,000 and Hold Forever","There is no shortage of excellent, low-cost exchange-traded funds ( ETFs ) that specialize in dividend stocks. There are some that focus on stocks that pay above-average dividends, stocks whose dividends grow rapidly, and dividend-paying stocks that have certain characteristics in common.",AAPL,0.19651,Somewhat-Bullish
20250304T131100,Why Visa & PayPal are Must-Buy Stocks in Apple's Cashless Revolution,Investors looking to capitalize on Apple's digital payments revolution may consider buying Visa and PayPal.,AAPL,0.327861,Somewhat-Bullish
20250304T133623,"Best Buy Revenue Upbeat, Health Drags","Best Buy surpassed earnings expectations for its fourth quarter, but faced challenges in its health division.",AAPL,0.257831,Somewhat-Bullish
20250304T140057,"Introducing New Cloud-Based CorelDRAW Go, Creative and Workflow Enhancements in CorelDRAW Graphics Suite 2025, and Browser-Based Design with CorelDRAW Web","CorelDRAW Go provides a beginner-friendly design experience, empowering creativity from anywhere. CorelDRAW Graphics Suite delivers Painterly Brush tool enhancements and streamlined print to PDF workflows, alongside flexible, online design with CorelDRAW Web.",AAPL,0.059558,Neutral
20250304T144520,Apple's $500B U.S. Investment? Analyst Calls It 'Completely Unrealistic' - Questions Where The Money Will Come From - Apple  ( NASDAQ:AAPL ) ,"Apple's AAPL latest announcement to invest $500 billion in the U.S. over the next four years has everyone talking. The tech giant plans to hire 20,000 people, expand its manufacturing presence, and build a massive new AI-focused factory in Texas.",AAPL,0.062974,Neutral
20250304T150052,"Inquiry Into Apple's Competitor Dynamics In Technology Hardware, Storage & Peripherals Industry - Apple  ( NASDAQ:AAPL ) ","In today's rapidly changing and fiercely competitive business landscape, it is essential for investors and industry enthusiasts to thoroughly analyze companies. In this article, we will conduct a comprehensive industry comparison, evaluating Apple AAPL against its key competitors in the ...",AAPL,0.364208,Bullish
20250304T151210,Apple Partner Globalstar Teams Up With GCT Semiconductor to Power Satellite Messaging with IoT Chips - Globalstar  ( NASDAQ:GSAT ) ,"GCT Semiconductor and Globalstar partner to develop two-way satellite messaging for mobile devices and IoT modules. Globalstar to use GCT's 4G LTE and 5G IoT chips, enabling seamless switching between cellular and satellite networks worldwide.",AAPL,0.240846,Somewhat-Bullish
20250304T161700,Sirius XM Plunges 42.3% in a Year: How Should You Play the Stock?,"SIRI expands content and improves engagement, but with falling subscription revenues and strong competition, investors can wait for better entry points.",AAPL,0.080981,Neutral
