published_date,title,summary,ticker,ticker_sentiment_score,ticker_sentiment_label
20250211T165714,Apple's AI Split: Chooses Alibaba For China And OpenAI For Everyone Else - Alibaba Gr Hldgs  ( NYSE:BABA ) ,Apple teams up with Alibaba to bring AI features to iPhones in China as it fights to regain lost market share Apple submits AI features co-developed with Alibaba for China's approval after Baidu partnership falls through,AAPL,0.242771,Somewhat-Bullish
20250212T053031,"Trump White House Boasts Apple's 'Gulf Of Mexico' Rename, But Pinch To Zoom And You Might Be Surprised - Alphabet  ( NASDAQ:GOOG ) , Apple  ( NASDAQ:AAPL ) ","On Tuesday, Apple Inc. AAPL renamed the Gulf of Mexico to Gulf of America on its Maps app, following an executive order signed by U.S. President Donald Trump on his first day in office. What Happened: The U.S. government officially updated its maps to reflect the new name.",AAPL,0.06662,Neutral
20250212T065419,"Apple ID Switching No Longer Needed - Here's How To Migrate Your Apps, Music, Or Subscriptions","On Tuesday, Apple Inc. quietly rolled out a purchase migration feature, allowing users to consolidate purchases made on a secondary account into their primary one. What Happened: The change was detailed in a newly published support document, which outlines the exact process and requirements for ...",AAPL,0.0,Neutral
20250212T091400,"The Best Warren Buffett Stocks to Buy With $1,000 Right Now",The Oracle of Omaha's picks are universally sound enough to work in almost anyone else's portfolio as well.,AAPL,0.158074,Somewhat-Bullish
20250212T093200,Best Stock to Buy Right Now: Amazon vs Apple,"Amazon ( NASDAQ: AMZN ) and Apple ( NASDAQ: AAPL ) have become among the world's most recognized companies. They've also become very valuable, with the former's market cap exceeding $2.4 trillion and the latter's about $3.4 trillion.Both have been very successful and rewarding for shareholders ...",AAPL,0.30092,Somewhat-Bullish
20250212T094134,"Dow Gains Over 100 Points Following Powell Comments: Fear & Greed Index Remains In 'Neutral' Zone - Alibaba Gr Hldgs  ( NYSE:BABA ) , Apple  ( NASDAQ:AAPL ) ","The CNN Money Fear and Greed index showed almost no change in the overall market sentiment, with the index remaining in the ""Neutral"" zone on Tuesday. U.S. stocks settled mixed on Tuesday, as investors digested comments from Federal Reserve Chair Jerome Powell.",AAPL,-0.216193,Somewhat-Bearish
20250212T095100,Prediction: Warren Buffett's Stock-Selling Streak Will Extend to 9 Quarters,The Oracle of Omaha's short-term actions don't always align with his long-term approach.,AAPL,0.066491,Neutral
20250212T103000,"Warren Buffett Sells Apple Stock and Buys an Industry-Leading Stock Up 3,400% Since Its IPO","Warren Buffett oversees the vast majority of Berkshire Hathaway's equity holdings, while fellow investment managers Todd Combs and Ted Weschler handle a small percentage of the $299 billion portfolio. Berkshire doesn't disclose which trades are made by which person, but Buffett almost certainly ...",AAPL,0.239258,Somewhat-Bullish
20250212T112005,Should You Invest in the Fidelity MSCI Information Technology Index ETF  ( FTEC ) ?,Sector ETF report for ...,AAPL,0.051176,Neutral
20250212T112007,Should Schwab U.S. Large-Cap Growth ETF  ( SCHG )  Be on Your Investing Radar?,Style Box ETF report for ...,AAPL,0.067379,Neutral
20250212T112007,Is iShares Core S&P U.S. Value ETF  ( IUSV )  a Strong ETF Right Now?,Smart Beta ETF report for ...,AAPL,0.062665,Neutral
20250212T121914,"Time To Trim Big Tech? This Analyst Says Reducing 'Mag 7' Exposure Is Now 'Prudent' This Analyst Gives Three Reasons To Trim ""Magnificent Seven"" Holdings. 'Lowering Exposure Is Prudent' - Apple  ( NASDAQ:AAPL ) , Amazon.com  ( NASDAQ:AMZN ) ","The CEO of Trivariate Research, Adam Parker, recommended investors reduce their exposure to the ""Magnificent Seven"" stocks amid high valuation and related risks. What Happened: ""Over the last several years we have maintained the view, that it was prudent for long-only U.S. equity managers to be ...",AAPL,0.027731,Neutral
20250212T122200,Prediction: Warren Buffett and Berkshire Hathaway Sold $25 Billion in Apple Stock in Q4,"Apple ( NASDAQ: AAPL ) has been one of Warren Buffett and Berkshire Hathaway's ( NYSE: BRK.A ) ( NYSE: BRK.B ) most profitable and famous investments. However, they've been selling off their shares pretty methodically lately.Berkshire's Apple holding peaked in third-quarter 2023, when it held ...",AAPL,0.253609,Somewhat-Bullish
20250212T131407,"Apple Finds Its AI Wingman In Alibaba - Can It Power An iPhone Comeback In China? - Alibaba Gr Hldgs  ( NYSE:BABA ) , Apple  ( NASDAQ:AAPL ) ","Apple partners with Alibaba to bring AI features to iPhones in China, boosting investor confidence. The AI rollout could drive an iPhone upgrade cycle, positioning Apple for a potential resurgence in China.",AAPL,0.398357,Bullish
20250212T142100,"Company News for Feb 12, 2025","Companies in The News Are: AAPL, TSLA, KO, SHOP ...",AAPL,0.484914,Bullish
20250212T145051,"Taiwan Semiconductor Under Pressure From Trump Tariff Threats, Could Push Advanced Packaging Capacity to US - Taiwan Semiconductor  ( NYSE:TSM ) ","Taiwan dispatches deputy economy minister to Washington as Trump threatens semiconductor tariffs Taiwan Semiconductor faces uncertainty as Trump eyes tariffs, US CHIPS Act subsidies at risk Get two weeks of free access to pro-level trading tools, including news alerts, scanners, and real-time ...",AAPL,0.0,Neutral
20250212T150052,"Market Analysis: Apple And Competitors In Technology Hardware, Storage & Peripherals Industry - Apple  ( NASDAQ:AAPL ) ","Amidst the fast-paced and highly competitive business environment of today, conducting comprehensive company analysis is essential for investors and industry enthusiasts.",AAPL,0.353886,Bullish
20250212T161100,Apple Down 7% Year to Date on iPhone Weakness: Buy or Hold the Stock?,"Although AAPL's AI push and growing Services business are positives, stretched valuation and China headwinds are concerning in 2025.",AAPL,0.488035,Bullish
20250212T173257,"Why Chinese Stocks Alibaba, Futu Holdings, and Tencent Shook Off Inflation Concerns and Are Rising Today","Despite a hotter-than-expected inflation report this morning, Chinese tech stocks shook off the bad news and marched higher. The beaten-down sector continues to advance since the emergence of China's DeepSeek artificial intelligence ( AI ) chatbot.Shares of the large search and e-commerce company ...",AAPL,0.039281,Neutral
20250212T175452,"Apple Teams Up With Alibaba for AI, Analyst Says Edge Device Integration Could Boost Growth - Alibaba Gr Hldgs  ( NYSE:BABA ) , Apple  ( NASDAQ:AAPL ) ","Apple partners with Alibaba to develop AI features for China, submits for regulatory approval. Analyst sees Apple benefiting from AI on edge devices, eyes China market share recovery. Get real-time earnings alerts before the market moves and access expert analysis that uncovers hidden ...",AAPL,0.602184,Bullish
20250212T194209,"Why The MAGS ETF Has Remained Flat Year-to-Date Despite Some Strong Performers - Alphabet  ( NASDAQ:GOOGL ) , Apple  ( NASDAQ:AAPL ) ","Tesla, one of the seven stocks in MAGS, has been a major drag on the ETF's performance. Meanwhile, Meta has been a bright spot, driven by robust advertising revenue and more. Get real-time earnings alerts before the market moves and access expert analysis that uncovers hidden opportunities in ...",AAPL,-0.067828,Neutral
20250212T194535,Decoding Apple's Options Activity: What's the Big Picture? - Apple  ( NASDAQ:AAPL ) ,"Deep-pocketed investors have adopted a bullish approach towards Apple AAPL, and it's something market players shouldn't ignore. Our tracking of public options records at Benzinga unveiled this significant move today.",AAPL,0.330414,Somewhat-Bullish
20250212T213543,Softbank-Backed Arm Holdings 155% Post-IPO Surge Bolstered by AI Growth and Smartphone Integration - ARM Holdings  ( NASDAQ:ARM ) ,"Arm stock surged 157% since IPO, CEO sees AI as key to smartphone and PC market growth Arm targets 50% of Windows PC market, boosts AI role in OpenAI's $100B Stargate project Get real-time earnings alerts before the market moves and access expert analysis that uncovers hidden opportunities in ...",AAPL,-0.171429,Somewhat-Bearish
20250213T065604,"Apple Intelligence Rollout In China And Europe To Boost iPhone Sales, Says Deepwater's Gene Munster - Alibaba Gr Hldgs  ( NYSE:BABA ) , Apple  ( NASDAQ:AAPL ) ","Apple Inc. AAPL is set to introduce artificial intelligence ( AI ) features in China in collaboration with Alibaba Group Holdings BABA, a move that could potentially stimulate iPhone sales growth in the region, following a challenging period of declining sales.",AAPL,0.394874,Bullish
20250213T100700,Roughly 62% of U.S. Adults Hold Stocks. Those Who Don't Could Be Missing Out on Millions.,"The other 38% could still be applying investors' wealth-building strategy for themselves, even if they start on a smaller scale.",AAPL,0.100519,Neutral
20250213T111100,"The Zacks Analyst Blog Apple, Microsoft, Alphabet and Amazon","Chicago, IL - February 13, 2025 - Zacks.com announces the list of stocks and ETFs featured in the Analyst Blog. Every day the Zacks Equity Research analysts discuss the latest news and events impacting stocks and the financial markets.",AAPL,0.457134,Bullish
20250213T112006,Should Schwab Fundamental U.S. Large Company ETF  ( FNDX )  Be on Your Investing Radar?,Style Box ETF report for ...,AAPL,-0.025608,Neutral
20250213T112008,Should Vanguard Russell 1000 Growth ETF  ( VONG )  Be on Your Investing Radar?,Style Box ETF report for VONG ...,AAPL,0.069101,Neutral
20250213T125200,Buy 3 Tech Mutual Funds for AI and Semiconductor Growth,"Invest in tech mutual funds like FSELX, KTCAX and PRSCX that focus on AI, cloud expansion and the semiconductor boom.",AAPL,0.056177,Neutral
20250213T131912,"Not Just DeepSeek, China's AI Landscape Heats Up As Baidu Launches Free Ernie Bot - Baidu  ( NASDAQ:BIDU ) ","Baidu to launch Ernie 5.0 in late 2025 and offer Ernie Bot free to all users from April 1, intensifying China's AI competition. BIDU stock rises as Baidu expands AI offerings, slashes costs, and challenges rivals like Alibaba and OpenAI.",AAPL,0.11025,Neutral
20250213T132556,"Apple's Next Big Bet? Tim Cook-Led Company Is 'Exploring' Humanoid As Well As Non-Humanoid Robots For Smart Home Future, Says Top Analyst Apple's Future Smart Home Ecosystem May Include Robots, Says Ming-Chi Kuo. 'Exploring both humanoid and non-humanoid - Tesla  ( NASDAQ:TSLA ) ","Apple Inc. AAPL is reportedly exploring the development of humanoid and non-humanoid robots for its future smart home ecosystem, according to a post by TF International Securities analyst Ming-Chi Kuo.",AAPL,0.221359,Somewhat-Bullish
20250213T140000,"Ignore the Headlines, Buy Chinese Stocks","Despite concerns surrounding China's economy, a confluence of factors suggest a compelling bullish case for Chinese equities. Resilient price action, contrarian sentiment, government stimulus, attractive valuations, and rapid AI advancements create immense growth potential.",AAPL,0.008569,Neutral
20250213T150049,"Exploring The Competitive Space: Apple Versus Industry Peers In Technology Hardware, Storage & Peripherals - Apple  ( NASDAQ:AAPL ) ","In the fast-paced and cutthroat world of business, conducting thorough company analysis is essential for investors and industry experts. In this article, we will undertake a comprehensive industry comparison, evaluating Apple AAPL in comparison to its major competitors within the Technology ...",AAPL,0.310197,Somewhat-Bullish
20250213T171650,"Trump White House Bans AP Reporter Over 'Gulf Of America' Conflict: Is A First Amendment Court Case In The Works? - Alphabet  ( NASDAQ:GOOG ) , Apple  ( NASDAQ:AAPL ) ",The AP said it was blocked because it hadn't changed its stylebook entry for Gulf of Mexico to 'Gulf of America' as ordered by Trump. An AP exec said the agency will 'defend its constitutional rights' and the public's right to independent news coverage of their government.,AAPL,0.0,Neutral
20250213T171655,"Apple Is Back With Ads On X After Halting Platform Spending In 2023 Over Elon Musk's Posts - Apple  ( NASDAQ:AAPL ) , Amazon.com  ( NASDAQ:AMZN ) ","Apple is once again advertising on X after a 15-month break. The return to X advertising spending comes with Apple CEO Tim Cook attending Donald Trump's inauguration, where Elon Musk was. Get access to your new suite of high-powered trading tools, including real-time stock ratings, insider ...",AAPL,0.142623,Neutral
20250213T213021,Steve Jobs Feared His Porsche 911 Would Display His Wealth And Cost Him A $20 Million Deal-So He Scrambled To Hide It From Ross Perot - Apple  ( NASDAQ:AAPL ) ,"Steve Jobs was known for his obsession with perfection in the products he created and the cars he drove. His love for the Porsche 911 was legendary, and for years, he swapped his black Porsche for a new one every six months for a very Jobs-like reason - to avoid having a license plate.",AAPL,0.136787,Neutral
20250214T000043,"Full-Shopping Boycotts Sweep Europe Over High Prices-Now, One US Community Is Following Suit But For A Different Cause - Apple  ( NASDAQ:AAPL ) , Costco Wholesale  ( NASDAQ:COST ) ","A wave of full-shopping boycotts has taken hold in parts of Europe, with consumers in the Balkans leading the charge against skyrocketing grocery prices. Now, a movement in the U.S. is adopting a similar strategy-but for an entirely different reason.",AAPL,0.064894,Neutral
20250214T025038,Apple Stock Closes Above $240 After 36-Day Gap -Jim Cramer Mocks Early Sellers: ' Who Told Us It Was Over?' - Apple  ( NASDAQ:AAPL ) ,"Apple Inc. AAPL closed at $241.53 on Thursday, marking its first close above $240 in 36 days. This prompted Jim Cramer, the host of ""Mad Money,"" to take a jab at early sellers who doubted the stock's resilience.",AAPL,-0.060628,Neutral
20250214T035117,"Arm Takes On Its Own Customers - Poaches Talent, Competes With Qualcomm And Nvidia For AI And Data Center Chip Deals: Report - Apple  ( NASDAQ:AAPL ) , ARM Holdings  ( NASDAQ:ARM ) ","British chip designer Arm Holdings Plc ARM is reportedly entering the chip sales market, directly competing with its own clients, including Qualcomm Inc. QCOM and Nvidia Corporation NVDA, for AI and data center chip deals.",AAPL,0.058878,Neutral
20250214T050129,"Tim Cook Confirms New Apple Product Launch Next Week, Elon Musk Sets Off Buzz By Sharing - Is It The iPhone SE 4? - Apple  ( NASDAQ:AAPL ) ","On Thursday, Apple Inc. AAPL CEO Tim Cook officially confirmed a new product launch on Feb. 19, fueling speculation that the company will unveil the iPhone SE 4. What Happened: Cook announced the launch via a post on X, formerly Twitter, using the hashtag #AppleLaunch, and said, ""Get ready to ...",AAPL,0.148614,Neutral
20250214T070102,"Apple, Tesla And Other MAG 7 Peers Too Expensive? Top Hedge Fund Challenges 'Overvaluation' Concerns - Apple  ( NASDAQ:AAPL ) , Amazon.com  ( NASDAQ:AMZN ) ","Top Hedge Fund Bridgewater Associates has questioned the widespread notion that the 'Magnificent Seven' stocks are overvalued, while the rest of the S&P 500 stocks are comparatively undervalued.",AAPL,0.097144,Neutral
20250214T070154,"Claudia Sheinbaum Says Mexican Government May Sue Google Over 'Gulf Of Mexico' Name Change - Alphabet  ( NASDAQ:GOOG ) , Apple  ( NASDAQ:AAPL ) ","Mexican President Claudia Sheinbaum said Thursday that her government may file a civil lawsuit against Alphabet Inc.'s GOOG GOOGL Google for labeling the Gulf of Mexico as the ""Gulf of America"" on its maps, following a controversial decree by U.S. President Donald Trump.",AAPL,0.066481,Neutral
20250214T070300,"Zacks Investment Ideas feature highlights Alibaba, JD.com, Baidu, KWEB and Apple","Alibaba, JD.com, Baidu, KWEB and Apple have been highlighted in this Investment Ideas article.",AAPL,0.007467,Neutral
20250214T090000,"This Warren Buffett Index Fund Could Turn $400 Per Month Into $868,200","Warren Buffett is one of the most successful investors in U.S. history. Under his control, Berkshire Hathaway shares have returned about 20% annually since 1965. And brilliant investments engineered by Buffett played an important role in that shareholder value creation.Naturally, Buffett has ...",AAPL,0.172086,Somewhat-Bullish
20250214T095200,Here's How Generative AI Factors Into Amazon's Plan for Growth,"Amazon ( NASDAQ: AMZN ) ranks among the greatest growth stories in the stock market. Jeff Bezos founded the company in his garage in 1994 as an online bookseller. It's now the leader in e-commerce and cloud services. Amazon's share price has skyrocketed an astounding 234,700%, giving it a market ...",AAPL,0.0,Neutral
20250214T110732,"TikTok Returns To Apple And Google App Stores After A Month-Long Hiatus - Alphabet  ( NASDAQ:GOOG ) , Apple  ( NASDAQ:AAPL ) ","TikTok, the Chinese short video platform, has reappeared on the Apple and Google app stores following a month-long hiatus. What Happened: TikTok officially announced that the app was restored to the app stores of Apple Inc. AAPL and Alphabet Inc. GOOGL GOOG on Thursday evening.",AAPL,-0.172344,Somewhat-Bearish
20250214T112006,Should iShares S&P 500 Value ETF  ( IVE )  Be on Your Investing Radar?,Style Box ETF report for IVE ...,AAPL,0.062665,Neutral
20250214T131121,Taiwan Semiconductor Eyes US Expansion Amid Push for Bigger Investments and Advanced Chip Production - Taiwan Semiconductor  ( NYSE:TSM ) ,"Taiwan promises to boost US trade and defense ties, addressing Trump's chip concerns as TSMC invests $65B in Arizona fabs. TSMC ramps up US expansion, spending $17.14B on advanced chips and packaging as Taiwan pushes for a global AI chip alliance.",AAPL,0.076936,Neutral
20250214T140015,Investors Heavily Search Apple Inc.  ( AAPL ) : Here is What You Need to Know,"Recently, Zacks.com users have been paying close attention to Apple (AAPL). This makes it worthwhile to examine what the stock has in store.",AAPL,0.174123,Somewhat-Bullish
20250214T142151,"Apple Focuses On Alibaba, Baidu Partnership In Race To Bring AI Features To China by Mid-2025 - Alibaba Gr Hldgs  ( NYSE:BABA ) ","Alibaba's AI models gain traction as Apple integrates its AI tech into iPhones, seeking to regain market share in China. Chinese stocks surge as Alibaba and DeepSeek counter US AI embargo with cost-effective AI models and strong market growth.",AAPL,0.47651,Bullish
20250214T150040,"Performance Comparison: Apple And Competitors In Technology Hardware, Storage & Peripherals Industry - Apple  ( NASDAQ:AAPL ) ","In today's rapidly changing and fiercely competitive business landscape, it is vital for investors and industry enthusiasts to carefully evaluate companies. In this article, we will perform a comprehensive industry comparison, evaluating Apple AAPL against its key competitors in the Technology ...",AAPL,0.411105,Bullish
20250214T173500,ARM Stock Surges 12% in a Month: Buy or Wait for a Pullback?,"Given the recent surge in Arm Holdings shares, we evaluate the stock's current position to determine whether it presents a good investment opportunity.",AAPL,0.088711,Neutral
20250214T180000,Is Meta Now the Lone Star in the Big Tech Cohort? ETFs in Focus,Meta shares have gained the most in the big tech cohort this year. Here's why.,AAPL,0.012623,Neutral
20250214T201511,Here's How Much $1000 Invested In Apple 5 Years Ago Would Be Worth Today - Apple  ( NASDAQ:AAPL ) ,"Apple AAPL has outperformed the market over the past 5 years by 12.46% on an annualized basis producing an average annual return of 25.09%. Currently, Apple has a market capitalization of $3.67 trillion.",AAPL,0.384695,Bullish
20250214T220500,3 Lessons from Buffett's Apple Stock Sales,"Tracey Ryniec, Zacks Value Stock Strategist, discusses what value investors can learn from Warren Buffett???s move to sell shares in one of his 4 pillars.",AAPL,0.192014,Somewhat-Bullish
20250214T225400,"Top Stock Reports for Apple, Eli Lilly & Shopify","Today's Research Daily features new research reports on 16 major stocks, including Apple Inc. (AAPL), Eli Lilly and Company (LLY) and Shopify Inc. (SHOP), as well as a micro-cap stock ImmuCell Corporation (ICCC).",AAPL,0.35517,Bullish
20250215T051550,"Mark Zuckerberg Follows Elon Musk's Footsteps As Meta Reportedly Plans Major Investment Into AI-Powered Humanoid Robots - Apple  ( NASDAQ:AAPL ) , General Motors  ( NYSE:GM ) ","Mark Zuckerberg could be following Elon Musk's footsteps, as Meta Platforms Inc. META is reportedly planning a significant investment into AI-powered humanoid robots. What Happened: Meta is forming a new team within its Reality Labs hardware division to spearhead this initiative, according to ...",AAPL,0.145637,Neutral
20250215T081400,"Surprise: McDonald's Has Higher Profit Margins Than Tesla, Apple, or Netflix","Restaurants have notoriously low profit margins. But McDonald's ( NYSE: MCD ) , the world's largest restaurant chain, is surprisingly one of the most profitable businesses. In fact, its profit margins are higher than prestigious businesses such as Tesla ( NASDAQ: TSLA ) , Apple ( NASDAQ: AAPL ) , ...",AAPL,0.265312,Somewhat-Bullish
20250215T084143,"Activist Investor Dan Loeb Boosts Stake In Mark Zuckerberg's Meta And Elon Musk's Tesla, But Sold These Three Mag 7 Stocks In Q4 - Apple  ( NASDAQ:AAPL ) , Amazon.com  ( NASDAQ:AMZN ) ","Activist investor Dan Loeb's Third Point LLC has significantly ramped up its stakes in Flutter Entertainment FLUT, Elon Musk's Tesla Inc. TSLA, and Mark Zuckerberg's Meta Platforms Inc. META during the final quarter of 2024.",AAPL,0.045879,Neutral
20250215T085117,"Bill Gates Wanted A Friend To 'Take Charge' Of Microsoft Due To Regret Over Leaving Harvard, But Here's Why He Panicked And Dropped Out - Microsoft  ( NASDAQ:MSFT ) , Intel  ( NASDAQ:INTC ) ","Bill Gates, co-founder of Microsoft Corp. MSFT, expressed regret over leaving Harvard University to start the tech giant. What Happened: Gates, who was a Harvard undergraduate at the time, struggled with the decision to leave school despite having a great time there, according to a CNBC report.",AAPL,0.129007,Neutral
20250215T100857,"Steve Jobs-Signed Rare Apple Business Card Goes Up For Auction, Bids Touch $75,000","A rare business card signed by late Apple Inc. co-founder Steve Jobs is drawing significant attention at an ongoing auction. What Happened: This unique piece of memorabilia, dating back to 1983, features Jobs's signature alongside the iconic Apple rainbow logo.",AAPL,0.097466,Neutral
20250215T153019,"Bulls and Bears: Apple, Nvidia, Netflix and Trader Predicts Dogecoin Surge by March 24 Bulls and Bears: Apple, Nvidia, Netflix and Trader Predicts Dogecoin Surge by March 24 - Alcoa  ( NYSE:AA ) ","Benzinga examined the prospects for many investors' favorite stocks over the last week - here's a look at some of our top stories. The S&P 500 rose about 1.5% this week, while the Dow gained 0.6% and the Nasdaq climbed 2.6%.",AAPL,0.0,Neutral
20250215T160017,"Berkshire Hathaway Adjusts Portfolio, Keeps Apple Stake Unchanged, Offloads Stakes in BofA - Apple  ( NASDAQ:AAPL ) , Bank of America  ( NYSE:BAC ) ","Buffett's Berkshire Hathaway reshuffles its portfolio, maintaining a strong grip on Apple shares. Buffett's latest moves stir curiosity ahead of his much-anticipated annual letter to investors.",AAPL,0.381767,Bullish
20250216T093500,Have $500? 3 Absurdly Cheap Stocks Long-Term Investors Should Buy Right Now.,"At first glance, it may not look like a great time to find ""cheap stocks."" The S&P 500 is close to all-time highs, and some of the more prominent consumer stocks are the reason for its performance.Nonetheless, the rally has left some of these stocks behind amid temporary challenges.",AAPL,0.063994,Neutral
20250216T120018,"Steve Jobs' Signature, New Apple Launch, And Ankle Watches: This Week In Appleverse - Apple  ( NASDAQ:AAPL ) ","The week was buzzing with Apple Inc. AAPL news. From a rare Steve Jobs-signed business card going under the hammer to the announcement of a new product launch, Apple has been making headlines. Let's dive into the top stories. A unique piece of Apple history is drawing significant attention at an ...",AAPL,0.307349,Somewhat-Bullish
20250216T154516,"Consumer Tech News  ( Feb 10-Feb 14 ) : US & UK Denied Signing Global AI Safety Declaration, Musk To Settle $10 Million Trump Lawsuit & More - Alphabet  ( NASDAQ:GOOG ) , Apple  ( NASDAQ:AAPL ) ","Lyft Q4 revenue beat estimates at $1.6B; net income hit $61.7M vs. a $26.3M loss last year. OpenAI's ChatGPT now ranks as the 6th most-visited website globally. Get two weeks of free access to pro-level trading tools, including news alerts, scanners, and real-time market insights.",AAPL,0.039443,Neutral
20250216T205016,"Apple and Meta in Race To Develop AI-Powered Humanoid Robots - Meta Platforms  ( NASDAQ:META ) , Apple  ( NASDAQ:AAPL ) ","Apple and Meta gear up for a robotic showdown, chasing the creation of AI-driven humanoid robots. AI-powered robots poised to disrupt sectors from healthcare to home life as tech titans race for supremacy.",AAPL,0.195159,Somewhat-Bullish
20250217T020412,"Xi Jinping Meets Tech Giants As Chinese Markets Rally On Private Sector Support  ( UPDATED )  - Alibaba Gr Hldgs  ( NYSE:BABA ) , Apple  ( NASDAQ:AAPL ) ","Editor's Note: This article has been updated to include the latest information on Xi Jinping's meeting with technology leaders and associated market fluctuations. Chinese President Xi Jinping held a rare high-level symposium with the country's leading entrepreneurs on Monday, including Alibaba ...",AAPL,0.205568,Somewhat-Bullish
